index,hot,title,href
1,12008272,欧洲杯八强出炉
2,11679243,奥地利1:2土耳其
3,11460410,哈萨克斯坦首都挂起五星红旗
4,11436254,嫦娥六号31马赫是什么概念
5,10724813,荷兰3:0罗马尼亚
6,10526785,新一轮汽车价格战又来了吗
7,9416807,高铁上如何打发时间
8,9412032,黄皮是什么神仙水果
9,9277083,“80后”乘组将择机再出舱
10,9232755,李凯尔加盟勇士
11,9217364,欧洲杯四强预测
12,9216621,甜馨维护贾乃亮
13,9179436,世界羽联将彻查张志杰事件
14,9176817,这些汛情谣言不要信
15,9124813,官方辟谣上海向佛祖借了100亿
16,9106544,谭松韵许凯新剧抓马开局
17,8903782,赵今麦张凌赫最萌身高差比心
18,8592416,印尼羽协：张志杰因心脏骤停去世
19,8069084,陈一帆鼻子撞歪了
20,8004637,俄罗斯副防长被解职
21,7830997,印度踩踏事件已致130死
22,7818786,驯鹰这个赛道我先冲了
23,7806733,等你的回答全民出道挑战
24,7803753,这是一只超雄小猫咪吗
25,7771791,快闪开 班味儿回来了
26,7763227,当我用中式教育对待长辈
27,7758365,谁把流水席搬到马拉松了
28,7750568,魔性emergency运镜挑战
29,7745283,中国男篮87:107澳大利亚
30,7738910,不用为了找不到工作而焦虑
31,7736907,郑爽电视剧出品公司股权被冻结
32,7734786,Hot like me舞蹈大赛
33,7728991,你轮回的印记落在我眉宇
34,7721716,爱的本质是被看见
35,7709360,各地的孩子都会懂
36,7708003,等不到你的晚安
37,7697335,瑶一瑶小肉包快乐合集
38,7693829,张子墨还没养就成了
39,7693197,先别管猫了快去救车厘子
40,7692518,土耳其舞蹈多人版
41,7688255,这么爱你连她都没赢过
42,7683637,你如何看待百花奖提名
43,7683353,娃娃：不是我蛋糕呢
44,7675046,珀尔仿妆
45,7672451,白鹿挂脖吊带裙造型
46,7667868,本届欧洲杯的那些决胜时刻
47,7661707,一眼万年合拍挑战
48,7661435,亲手制作了一朵七色花
49,7657232,东北农村都吃什么美食
50,7654164,白俄阅兵彩排现场响起国歌
