index,hot,title,href
1,11122665,新疆小伙两破全国纪录
2,11061867,用诺米阿普的思念打开川西
3,10979821,清明踏青赏花游热度增超7倍
4,10936100,周杰伦日本演唱会
5,10240927,曼城4:2逆转水晶宫
6,9848737,韩媒：中国足球亚洲前十都进不了
7,8699619,人尴尬的时候会假装很忙
8,8559114,BLG击败NIP
9,8547337,小米辟谣汽车后轮螺丝脱落
10,8545817,广州全市已转移279人
11,8509582,以媒称伊朗已决定攻击以色列
12,8509540,追风者林樵松背刺美娟
13,8508373,国际婚姻能解决大龄男青年婚恋吗
14,8501187,开封王婆称自己是恋爱脑
15,8498356,以色列被曝用AI生成杀戮名单
16,8475882,赣闽粤局地将迎暴雨或大暴雨
17,8470986,赵奕欢演出了母亲的失魂落魄
18,8395033,伊朗发布即将报复以色列宣传片
19,8367377,与凤行闺蜜局
20,8340899,沈近真救人下线意难平
21,8338462,江苏福彩回应男子梦到中奖号码
22,8337737,兰大回应虐猫考生进调剂名单
23,8331314,能看出你俩不是i人
24,8282387,诺米这首孤独材料也好绝
25,8270849,彭锦西整治贾为民好解气
26,8268936,家属回应女子被卷进扶手梯
27,8263085,囤金大户变现
28,8256552,俄一大坝决堤1800多栋房屋被淹
29,8232950,手机卡二次放号乱象
30,8231448,陈赫快被吓碎了
31,8222207,春游该有的样子
32,8206704,打卡与凤行同款取景地
33,8191710,诺米家乡的蓝花楹开了
34,8191346,官方回应小米SU7线束是铝不是铜
35,8188540,深圳进入暴雨防御状态
36,8161100,云南昭通发生4.9级地震
37,8119390,当普通人化亚裔混血妆
38,8061273,孙子在爷爷坟前吃供品引热议
39,8027846,黄晓明说林更新流量大
40,8025206,福宝四川基因觉醒
41,7867197,与凤行沈璃行止的婚后生活
42,7805075,老舅坐鹿晗大腿
43,7805030,台湾花莲地震已造成13死1145伤
44,7778146,你讨厌乘车高声打电话的人吗
45,7769966,对你好不好情侣挑战
46,7767702,买房“以旧换新”释放什么信号
47,7764979,化妆师兔子爆改花小龙
48,7763977,韶关内涝
49,7762483,沈近真沈图南无言的告别
50,7743624,毫无果张力
