index,hot,title,href
1,12134262,郑钦文1:2高芙
2,11452125,皇马4:0奥萨苏纳
3,11377203,五年内无人机数量预计超千万
4,11349532,2024合肥马拉松
5,10739731,传奇杯S2前瞻
6,10494662,陈赫生日问孙俪借邓超
7,9285244,周鸿祎称已买十几辆国产智能车
8,9259128,轮到关晓彤被年龄暴击了
9,9153906,雷军的双十一推荐清单
10,9111773,制片人否认麦琳要求重新剪辑
11,9083837,丁禹兮慕声黑莲花具象化
12,9083719,向太帮向佐理发
13,9078766,贵州10岁女孩展示轻功
14,9034417,上海辟谣龙湖天街发生命案
15,9031955,麦琳退掉李行亮给女儿买的汉服
16,8708400,AG战胜KSG
17,8627165,TheShy和Rookie被曝回归iG
18,8460351,等一下让我爆改
19,8441962,郑钦文回应世界排名提升
20,8291329,Uzi和Ming老头杯合体
21,8278815,黄子韬一直播徐艺洋就得治他
22,8186294,永夜星河被腾讯赐名星帝
23,8129381,布朗尼替补席看老詹很无语
24,8099245,曝姆巴佩将退出法国队
25,8086956,到底是谁踩了她的咩咩鞋
26,8052153,暖暖入冬从穿搭开始
27,7983511,湖人轻取76人
28,7978986,珠海航展引台湾媒体高度关注
29,7918262,晓华称热度过去后只想好好剪发
30,7907940,小巷人家林栋哲想念爱人的具象化
31,7845911,“虎鲸”亮相珠海航展
32,7796157,王玉雯新剧被疯批霸总家暴
33,7783251,全抖音都在为家乡特产上分
34,7780046,致敬中国消防员
35,7774298,街舞满级小孩哥穿尿不湿登场比赛
36,7750582,疯狂动物城2
37,7749181,多架美国F15E战机抵达中东
38,7749069,凌妙妙对慕声的爱是下意识的
39,7748410,电影那个不为人知的故事观后感
40,7733911,分享我的房车生活
41,7727692,一个视频看懂化债
42,7719114,永劫手游S3赛季前瞻
43,7706432,鹿晗是老舅演唱会嘉宾
44,7701966,麦琳不顾葛夕感受乱花钱
45,7690203,林诗栋击败林昀儒
46,7688176,Faker曾因压力抑郁
47,7682532,斗破苍穹萧炎大战慕骨老人
48,7681807,滨崎步成都演唱会
49,7681427,太阳险胜独行侠
50,7677081,珠帘玉幕小虾米下线
