index,hot,title,href
1,11634364,理想汽车公布L7广东车祸视频
2,11494119,Jennie唱的我先用了
3,11182313,全国大部地区将回暖
4,11179829,大喜的日子却苦了猫猫
5,10772961,公主请告别2023
6,10284097,幼儿园男孩送女孩金条后续
7,9673856,南方人去东北能被一眼认出
8,9357533,婆媳之间传话有多重要
9,9317512,甘肃红会辟谣“高价采购清单”
10,9230301,5角钱早餐奶奶去世
11,9228795,vivo回应高管在印被捕
12,9169049,三只雪豹同框探头探脑
13,9157901,文森特将接受手术缺席6到8周
14,9132827,2023那些温暖美好念念不忘
15,9095242,行李收纳大法来啦
16,9052684,管泽元余霜婚礼
17,9006693,跨年夜和姐妹就这样拍吧
18,8999230,2023我的小成就
19,8998219,单依纯演唱会收官
20,8988191,大脑失眠部门
21,8963845,当臭美狗子遇上哈哈镜
22,8832519,哈妮一个人跑出了千军万马
23,8780641,邓为蓝毛衣卷发
24,8770737,还原永乐宫壁画仙女头冠
25,8756658,土耳其空袭伊拉克北部及叙利亚
26,8749802,当你和领导有代沟
27,8656506,2023国产烂片爆笑盘点
28,8628930,X战队vs瓷器厂
29,8617542,黄绮珊：没孩子是人生遗憾
30,8500226,张靓颖被虫子吓出E6
31,8456072,杨政恭喜瓷器厂
32,8353926,毛毛姐陪阿姨拿房本
33,8265352,东北室外泡温泉是什么体验
34,8251665,良田为梦想之家的孩子拍照
35,8249920,小宝宝智商大测试
36,8228213,考研结束的那一刻
37,8214417,老外克里斯当爸爸了
38,8176491,2023活力满满的特种兵旅行
39,8107454,河南多地机关单位暂停供暖
40,8093713,大哥：这不就是小孩吗
41,7970127,2023谢谢你爱我
42,7927686,我只是爱嘴上输出
43,7918868,张大仙收到五千万粉丝奖杯
44,7916593,比宜德疑似资金链断裂
45,7825657,爸爸别把我作业吃了
46,7778393,小米就某芯片公司事件辟谣
47,7771740,AG晋级世冠KIC四强
48,7692498,河北滦州2.8级地震
49,7610533,怎么跟烟花合照
50,7565993,小孩哥勇救坠楼小猫
