index,hot,title,href
1,11974760,王楚钦ISFP 孙颖莎ENTJ
2,11939300,孙颖莎回应用pin哄张本美和
3,11643565,何以中国寻根辽宁
4,11487835,孙颖莎说混双金牌是夺来的
5,10776373,印媒评印度0枚金牌
6,10578345,王楚钦感谢倪夏莲
7,9423524,世界羽联删除何冰娇女单排名
8,9412658,全红婵陈芋汐陈艺文一起撸猫
9,9359925,唐尚珺决定今年去读大学了
10,9316339,全红婵给爷爷打电话必有三连问
11,9306625,今年第7号台风“安比”生成
12,9253233,王楚钦介绍自己的pin
13,9244548,山东泰山战胜曼谷联
14,9236689,上海地铁辟谣1号线有人持刀
15,9204412,大熊猫彤彤因病死亡
16,9193896,王楚钦再回应主拍被踩断
17,9149856,私藏浪漫饶静赵方刚在一起了
18,9096459,全红婵父亲辟谣被游客打扰
19,9092068,羽协回应张志杰遗体仍在印尼
20,9078559,潮汕阿姨唱英文歌有多上头
21,9071687,这是我的“闪亮”老爸
22,9032490,知否曼娘李依晓官宣恋情
23,8919423,中国大唐3天内3人被查
24,8726576,广东新冠感染增加1万余病例
25,8706688,手机：从张若昀口袋安全撤离
26,8698571,一眼万年丹霞妆
27,8589024,王者双人同舞包有梗的
28,8542840,王楚钦被马龙抡到后的反应
29,8496529,潘展乐解散粉丝群
30,8456949,国潮包装是什么梗
31,8421702,乒乓球遇上甄嬛传
32,8310201,车臣特种部队手持火箭筒伏击乌军
33,8287507,孙颖莎冠军驾到直播来了
34,8246052,扎波罗热核电站遭袭背后有何算计
35,8231550,媒体评清水英男来中国谢罪
36,8181859,多省调整应届生身份认定标准
37,8180072,被热力波穿搭甜到了
38,8168966,美运动员吐槽奥运奖牌褪色
39,8127228,乌军在俄本土战况如何
40,8046065,体验贵州最野的漂流
41,8042857,永夜长明定档
42,8037155,和平精英升级手雷来了
43,7998432,沈腾新片逆鳞
44,7937782,当地回应两岁女童家门口失踪
45,7881001,如何看待王自如被限高
46,7852671,杜兰特考虑退役
47,7831871,王楚钦不愿再吃发型的苦
48,7802585,武功山景区夫妻俩漂流1死1伤
49,7775358,今天起进入末伏
50,7775112,广西通报德天瀑布景区事故原因
