index,hot,title,href
1,11318555,台媒拍到大陆舰艇在金门海域活动
2,11312385,俄军攻占扎波罗热多个乌军据点
3,11257033,神十七乘组第二次出舱
4,10997332,102岁“最潮奶奶”去世
5,10871563,解锁奶茶袋新用法
6,10357859,胖东来回应娃哈哈产品疑断货
7,10255271,万磊满分扣篮
8,10217192,王栎鑫谭松韵从振华中学就认识了
9,10182203,青海大坝溃堤未造成人员伤亡
10,9869402,开春第一条小黑裙
11,9631085,地理这本书我要多看几页
12,9466816,岳千灵当众告白被拒绝
13,9353878,韩国民众排长队告别福宝
14,9295356,航母航行值更官不仅是下口令
15,9194290,大熊猫福宝将不再与韩公众见面
16,9169855,孟佳说不能接受结过婚的伴侣
17,9151788,当福宝突然偷袭姜爷爷
18,9115605,网红猫猫咬咬去喵星了
19,9093205,媒体：中国到底需要什么样的孩子
20,9086677,被短剧有风美食馋哭了
21,9086313,成都蓉城2:0青岛海牛
22,9008588,pay姐你是真的火了
23,8986429,四肢瘫痪患者体验脑机接口
24,8985571,孙千好会记录小确幸
25,8980126,陈国豪MVP
26,8947525,曾经火爆的土木专业为何不香了
27,8937335,丐哥的饭碗要没了
28,8917439,张凌赫无框眼镜造型
29,8876895,祝你好运莲莲
30,8859226,王鸥生娃传闻后首现身
31,8845251,英雄联盟官方回应霸哥事件
32,8836473,许君聪面试演了段小品吧
33,8828021,涂山容容cos
34,8784917,吴镇宇试戏吻郑合惠子额头
35,8776622,瓦伦西亚2:2皇马
36,8775692,黄志忠刚上任就得罪领导
37,8770129,起风了翻唱
38,8715684,如何评价韦世豪新赛季中超首秀
39,8713599,全国网友一起迎接退役的你回家
40,8713164,张栋梁演欲言又止得到认可
41,8712730,皇马进攻未结束裁判就吹完场哨
42,8706471,骆王宇回应带货品牌争议问题
43,8688888,当男生看别对我动心
44,8686745,李明德即兴表演和父亲吵架
45,8620669,快递员吐槽工作时间增加了一倍
46,8587238,焉栩嘉承认谈过恋爱
47,8560058,韦世豪成都蓉城首秀
48,8547794,高海宁再现甜蜜蜜张曼玉哭戏
49,8510665,陈丽君 浪姐
50,8488107,中国援助物资已抵达蒙古国
