index,hot,title,href
1,12127555,文昌暴雨现场
2,11714321,海口市民讲述台风来袭景象
3,11150789,与“非”同行 合作共赢
4,11088540,这届月饼礼盒卷起来了
5,10496562,黑神话悟空穿搭style
6,10492206,岁月的推恩令
7,9371209,在美博主谈美国枪击案
8,9304020,徐正溪向粉丝道歉
9,9272016,多地积极应对台风摩羯
10,9200163,中秋三件套吃出国风美学
11,9183602,9月7日11时11分迎来白露节气
12,9182416,摩羯在广东徐闻二次登陆
13,9172524,什么是台风眼壁置换
14,9167896,高铁1公里耗1万度电系谣言
15,9127979,刘亦菲赵露思打招呼握手
16,9095179,台风摩羯给海口带来狂风暴雨
17,9048646,台风摩羯影响至少持续2到3天
18,8926609,国足抵达大连
19,8876308,五年级男孩持弓弩自曝杀猫虐猫
20,8636133,A股为何长期徘徊在3000点
21,8368385,摩羯可能还有第三次登陆
22,8339647,沉浸式开箱大疆无人机
23,8301145,黄庄月饼我先吃了
24,7858381,13岁少年游河南写下千字诗文
25,7807634,快手通报员工贩卖公司机密
26,7752029,俞敏洪延期3个月兑现新疆行
27,7744373,有一天这首歌会变老
28,7743710,猫猫：姥别喂了
29,7740568,当i人主播做吃播
30,7738387,和闺蜜拍一个蓄谋已久的视频吧
31,7731430,让我们祝贺这位伟大的女性
32,7717150,我们家小火人也融入蛋仔圈
33,7716181,实拍摩羯风力
34,7710456,台风来临如何应对
35,7708938,成为绘本里的温暖主角
36,7703682,张朝阳评论区网友真学上了
37,7703187,当高三生迎来第一个双休日
38,7685511,北舞严选的含金量还在上升
39,7685321,俄方：乌在库尔斯克集结新部队
40,7678225,窗户贴胶带为什么能防台风
41,7676605,当老师是一种怎样的体验
42,7673517,华为三折叠到底牛在哪
43,7667339,白鹿真的在30岁发歌了
44,7666988,前奏一响 白月光登场
45,7665553,感谢台风中的逆行者
46,7664972,姐姐你有男朋友吗
47,7660638,蛋仔派对新赛季隐藏皮肤
48,7659271,国足主帅：小组前4目标不变
49,7657128,第五人格新赛季精华爆料
50,7653073,赵丽颖乔妍耳骨夹造型好带感
