index,hot,title,href
1,11924424,巴萨4:1拜仁
2,11918374,库尔斯克战役战局走向如何
3,11546434,中俄记者喀山Vlog
4,11529563,鸿蒙NEXT体验测评
5,10929183,当打铁花遇上跑酷
6,10725193,每个人都有自己的时区
7,9545991,土耳其恐袭已致5死22伤
8,9494826,东北雨X系列账号名称被初始化
9,9337066,跟航天员一起围观太空菜园
10,9296767,公安网安查处侮辱英烈案
11,9197215,王自如离职格力后首次发声
12,9150040,如何捕捉中微子
13,9124586,曼城5:0布拉格斯巴达
14,9072809,国家数据局发布辟谣
15,9040438,来一场秋天的慢充旅行
16,8984572,金晨当众脱鞋拒绝荣梓杉
17,8974451,中微子是什么
18,8848786,氛围感大衣才是冬天新品主场
19,8772106,快来安排入冬四件套
20,8518045,杨子说黄圣依希望被看手机
21,8459810,荣耀MagicOS 9.0
22,8265439,秋冬宅家美食局
23,8257383,当我有一个抽象爸爸
24,8143730,梁靖崑总结蒙彼利埃冠军赛首战
25,7941912,广州文旅局回应金星演出遭拒批
26,7845559,周三其实是最会装的
27,7803782,考研失利后我在抖音读起了文学
28,7802791,朋友圈开实况盲盒
29,7793903,微信内测查删单向好友功能
30,7782974,贾跃亭：许家印曾要给我200亿
31,7752923,月亮它照墙根儿啊
32,7743392,周鸿祎990迈巴赫被拆
33,7742814,邪恶栀子花二创太绝了
34,7736512,让海水倒灌的罪魁祸首是什么
35,7736347,鞠婧祎把壁上观唱完了
36,7719943,期待刀郎澳门演唱会
37,7717660,美国大选对全球资产的影响
38,7713423,花少5的含金量还在上升
39,7707227,宝蓝拒绝力挺Ning
40,7705608,房贷利率普遍步入2字头
41,7701922,黎巴嫩再向以色列发射无人机群
42,7698391,到了冬天就这么穿
43,7691642,詹姆斯父子历史首次同台
44,7690782,又到了吃枞树菌的季节
45,7677653,拜登呼吁在政治上监禁特朗普
46,7666159,这届大学生为了通过体测有多拼
47,7663152,广东男篮战胜福建男篮
48,7659509,巴以冲突已致加沙42792人死亡
49,7659197,有心才能同行有爱才能共鸣
50,7656202,宝宝回忆年轻时候的自己
