index,hot,title,href
1,12107249,读书的意义在此刻具象化了
2,11261224,高清卫星图揭秘“基建奇迹”
3,11233602,詹俊评欧洲杯开赛至今最佳阵容
4,10578216,拜登会退出美国大选吗
5,10562079,炎亚纶确定获缓刑3年
6,9403087,一口酸爽到贵州
7,9377762,雨后荷花美到心尖尖上了
8,9373431,中哈企业家的双向奔赴
9,9373174,沈梦辰回应说没生气
10,9333796,电影野孩子撤档
11,9195492,冬病夏治的有效方法
12,9190578,重庆山体滑坡致14人遇难系谣言
13,9173776,卡文迪什环法35冠创历史
14,9139331,嘴哥挑战搬砖扛楼
15,9059475,冒牌教授“魏新河”真实身份
16,8871614,和平精英地铁逃生打法攻略
17,8768112,永劫无间新地图龙隐洞天
18,8760640,枪杀安倍嫌犯最新供述
19,8374543,绝区零首日预下载超百国登顶
20,8297802,中金回应“员工因降薪跳楼”
21,8274660,留学生视角下的中国仪仗队
22,8273843,詹姆斯续约湖人
23,8193587,第五人格狙击流愚人金
24,7973636,珀尔仿妆
25,7909056,袁弘张歆艺婚姻面临香菜危机
26,7882954,张静初回应被封杀
27,7845343,西宁通报2名学生先后因病离世
28,7809349,范志毅预测欧洲杯8强席位全对
29,7802286,马英九：大陆台湾都是中国一部分
30,7791335,当我用中式教育对待长辈
31,7776032,原来真的一眨眼就长大了
32,7734725,外交部回应芬兰总统言论
33,7725421,范志毅管泽元预测欧洲杯四强
34,7721204,青春没有售价铁腚马上出发
35,7717385,萌兰9岁生日快乐
36,7711609,歌手2024模仿大赛
37,7710235,小鱼海棠怀孕了
38,7708080,暮色回响清唱
39,7701044,今天啥也不干就玩
40,7696669,女孩离家出走卖电脑被店主识破
41,7692943,上海暴雨冰雹
42,7680701,这猫连名字都没有吗
43,7678708,遇到合拍的室友就是幸福
44,7677307,当无人驾驶车遇查酒驾
45,7676603,拉乌婆婆发文报喜
46,7670644,Jennie新歌我先用了
47,7669770,小狗是懂挠痒痒的
48,7669385,等你的回答全民出道挑战
49,7669298,林丹悼念张志杰
50,7668470,巴黎奥运村7月中旬开门迎客
