index,hot,title,href
1,11053845,央视龙年春晚
2,10882978,抖音经常刷到的歌上春晚了
3,10616312,锦绣中国年
4,10550353,沈腾接仙气马丽接地气
5,10099469,听到难忘今宵春晚就圆满了
6,10053916,正月初一拜大年
7,9808819,刘谦春晚带观众集体变魔术
8,9692626,民政局辟谣婚车司机亲新娘风俗
9,9655565,杨幂毛晓彤红裙子美翻了
10,9586518,瑶一瑶小肉包送上新春祝福
11,9578384,阿根廷队杭州行取消
12,9560507,尼格买提魔术穿帮
13,9472992,全球75%无偿工作由女性完成
14,9454023,多家卫视春晚跳科目三
15,9270205,白敬亭魏大勋魏晨新中式穿搭
16,9239937,动画片这个节目刀哭了
17,9215450,新年自己画了个对联
18,9152491,章若楠春晚演小品
19,9126404,撒贝宁现挂满分
20,9078383,拜年吉祥话说些啥
21,9066012,刘涛除夕夜晒四方年夜饭
22,9058306,岳云鹏孙越春晚做蹲起
23,9047068,章若楠春晚后台换了穿搭
24,8963316,央视龙年春晚西安分会场
25,8902207,萌娃的龙年祝福
26,8789091,0713终于顶峰相聚
27,8787616,单依纯海来阿木舞台故事感
28,8691591,谁懂啊任素汐又唱抒情歌
29,8671256,网红张典上河南春晚
30,8666851,明星五湖四海年夜饭开炫了
31,8574945,济公游本昌的龙年祝福请查收
32,8483879,西安分会场诗朗诵起鸡皮疙瘩
33,8420918,何炅带长沙分会场百人大合唱
34,8340606,看春晚主打一个认真
35,8269970,过年给大家表演个龙腾猫跃
36,8233836,迪丽热巴美到窒息
37,8229383,龙年第一条抖音我先发
38,8069650,看个春晚撕了一副扑克牌
39,8020279,心动是对你说新年快乐
40,7877645,海来阿木终于等到上春晚
41,7827528,梅西香港行主办方退款50%
42,7775746,公主王子请看烟花
43,7751278,沈腾穿孟宴臣同款
44,7685105,沈腾马丽第8次携手上春晚
45,7641312,都有谁拍到百乔上春晚了
46,7612361,大小杨哥一家人送新年祝福
47,7597642,邓紫棋新年祝大家转大钱
48,7470230,一年一度年夜饭大赏
49,7441581,张杰孙楠龙年唱龙
50,7423946,白敬亭魏大勋魏晨显眼包齐聚春晚
