index,hot,title,href
1,11708006,国足1:0击败巴林
2,11497848,泰森将对战杰克保罗
3,11267543,从钱凯到上海为何成秘鲁流行语
4,11182859,麦子奶奶来西双版纳圆梦了
5,10518648,国足历史上从未输过巴林
6,10465701,见识到了北疆风雪的威力
7,9295219,又是被尔滨旅游刷屏的一年
8,9274818,张玉宁反绝杀
9,9246211,前10月铁路发送旅客数创新高
10,9118276,再见爱人麦学后亮学来了
11,9107922,王者荣耀联动名侦探柯南
12,8883774,妙妙失忆忘了子期
13,8862020,央媒评李子柒回归仍是顶流
14,8771383,广东大亚湾石化区火灾系谣言
15,8412317,用永夜星河寄明月打开汉服穿搭
16,8103466,黄玲宋莹闺蜜变亲家
17,8035642,假如APT是李荣浩的歌
18,7842921,韩国警方回应女主播自曝在菲吸毒
19,7799221,李维刚和华哥开鱼塘盲盒了
20,7768637,广东梅州火炙羊肉酒
21,7751545,歼10CE为何那么受欢迎
22,7743330,航展摄影师的装备有多豪华
23,7742072,雷军珠海航展vlog来了
24,7721768,这就回村吧
25,7721038,别让世俗淹没远方的等待
26,7709117,三轮车兄弟有了属于自己的土地
27,7702225,参考蚊献是不是得写上
28,7701278,我听完你爱的歌 就上了车
29,7680817,巴西1:1委内瑞拉
30,7673466,蔡正元评“白帝”空天战机
31,7672188,全国的小巷都在用小巷人家转场
32,7666864,大冰找好友陪麦子阿姨往南出发
33,7657725,娄艺潇新歌妲己妩媚感拉满
34,7650250,2024广州车展新车抢先看
35,7646730,赵露思镜头下的珠帘玉幕剧组
36,7641794,62岁的博格丹飞过62种机型
37,7636210,学虞书欣主角思维开启美好人生
38,7634914,挑战唱不是谁都能唱的歌
39,7633937,上天给我安排的对象
40,7633218,小米汽车展示原地掉头
41,7631256,成毅新剧又碎了
42,7628548,鸣潮椿上线
43,7624301,甜度爆表的手势舞
44,7624033,人不能太陶醉
45,7622182,第一视角体验蹦极
46,7618788,绍伊古参观中国航展
47,7618231,一眼望去皆是人间烟火气
48,7611075,南天门计划真的存在吗
49,7608539,徐枫灿说军人不分男女
50,7592075,东北猫冬生活有多美
