index,hot,title,href
1,9726938,NBA公布全明星首发 库里落选
2,9507549,科比去世四周年
3,9490349,在中国种地的科技含量有多高
4,9401772,南北满级年夜饭大PK
5,9399270,雷政富刑满释放
6,9342227,牛仔服爆改包包
7,9302065,落马女厅官跑步机里藏黄金
8,9294359,小动保协会关注猴子虐猫事件
9,9212001,专家科普辟谣“寡妇年”
10,9174351,各地龙年打卡地大赏
11,9120447,川渝好吃嘴在抖音开吃了
12,9112659,这猫家教挺严啊
13,9047138,科学家警告小心北极僵尸病毒
14,9037852,贝雷帽到底怎么戴啊
15,9006301,超市3元以下饮料仅占10%左右
16,8998386,文旅版棒棒棒来上分
17,8946250,你被捐款平台强行收费过吗
18,8930545,三人成椅
19,8903749,龙年萌娃福气穿搭
20,8878926,只有“岳云鹏”是本人到场吗
21,8862387,张卫健空中彩排意外坠地
22,8830385,韩国13岁小女孩出道
23,8788520,张大大陈泽连麦
24,8766741,东方甄选薪酬开支大增近1.7倍
25,8740673,摇太阳彭昱畅有亿点恋爱脑
26,8715756,宋慧乔看秀状态
27,8704303,2024年春运开启
28,8699071,你也有今天钱恒反矫情达人
29,8675900,国防部回应中国军力世界第三
30,8666316,黑龙江文旅厅发布新年感谢信
31,8646375,媒体：美国在红海有求于中国
32,8583232,国防部：祖国统一 台湾当归
33,8547167,美食版偷偷偷走我的心
34,8539776,假期拍照出片全靠这些小东西
35,8522375,非遗文化里的年味有多浓
36,8498108,蛋糕鞋不就来了么
37,8437114,普京突访飞地加里宁格勒
38,8396343,土耳其军机发生故障紧急迫降
39,8389546,刘青云新电影讲给盲人听
40,8383063,鱼茶到底是什么味道
41,8349949,董宇辉透露刘德华将做客直播间
42,8340409,亚洲杯16强诞生
43,8339122,解锁年前聚餐新方式
44,8329986,马斯克身价一夜减少180亿美元
45,8270671,蜘蛛夫人内地定档
46,8257199,国足亚洲杯获20万美元保底奖金
47,8205345,我们变成一对 差点缘分
48,8198892,市民热线回应动物园猴猫共处
49,8145478,减重100斤的贾玲惊呆潘斌龙
50,8080385,GALA被爆线
