index,hot,title,href
1,11464285,铁路部门优化车票改签规则
2,11278633,小沈阳是有点子圈内人缘的
3,11199441,第九届亚冬会吉祥物亮相
4,10150342,火狐琥珀
5,10083451,田姥姥和山东姥姥的Battle
6,9956195,贾玲减肥100斤
7,9692645,电影动物园里贾冰被熊咬了
8,9576478,腾讯游戏 掉线
9,9491402,云南辟谣摩托车撞电动车致9死
10,9286866,2万买金镯竟是假货
11,9286202,欢迎来到繁花90年代
12,9219686,联合国飞机被劫持 有乘客死亡
13,9210286,小伙在北极偶遇四川老乡
14,9163752,日媒曝光小学生偷拍事件
15,9102156,那些让人意想不到的水杯
16,9093525,贾玲回忆24岁突击减肥
17,9051225,日本地震灾区收到大量过期物资
18,9006513,南宁蔓越莓领取现场
19,8955570,慧慧周短剧拿捏我的悬疑胃
20,8953468,这小羊驼还怪记仇的
21,8885588,24年过个24K年
22,8839669,娄艺潇千户苗寨民族风大片
23,8782906,梅西卖酒
24,8753488,男子在山中野居8年 家属发声
25,8751858,阚清子来冰雪大世界了
26,8716676,李若彤体验内蒙古传统服饰
27,8706287,中央大街的鸽子已成鸽猪
28,8685381,老人女儿回应张馨予买气球
29,8656227,汪汪界的礼尚往来
30,8553498,河南山西结成旅游搭子
31,8470328,彩虹夫妇希望收养四川弃婴
32,8408222,这样的老手艺已经不多了
33,8297472,伊朗海军扣押一艘美国油轮
34,8234258,广东文旅邀请大家来过暖冬
35,8189743,普京称将来会去千岛群岛
36,8163904,网友给吉林文旅安排明白了
37,8069208,哈尔滨冰王座登场
38,8025934,玩家历经8853次挑战击败BOSS
39,8018701,金毛能有多聪明
40,7943196,狗子这口骨头吃得真费劲
41,7900760,河南文旅涨粉超27万
42,7840996,关晓彤养了四只猫和三只狗
43,7833219,日本5岁男孩地震时被烫伤后去世
44,7805644,日本福岛发生集体食物中毒事件
45,7784337,知道为什么叫消气操了
46,7733674,谁丢了一只大金毛
47,7650331,是infp会懂的美甲吗
48,7648440,短甲能有多高级
49,7646424,回头告别从前的自己
50,7639751,独立女人战歌都有MV了
