index,hot,title,href
1,12112668,iOS18正式版上线
2,12103864,中秋节快乐
3,12094261,台风中的温暖力量
4,11596574,疑欲刺杀特朗普嫌犯被捕画面曝光
5,10964401,台风普拉桑或再奔江浙沪
6,10928560,分享一下我的中秋快乐碎片
7,9576406,美国降息对中国有什么影响
8,9468002,中秋节的由来
9,9429707,蛋仔超绝倒挂金钩
10,9404744,中秋节团圆的N个理由
11,9402625,奔驰退出腾势汽车
12,9363672,神与仙的区别是什么
13,9310686,中秋节为什么要吃月饼
14,9219605,上海辟谣男子台风天关窗坠楼
15,9211807,阻尼器的工作原理
16,9189154,俄军顿巴斯部队投入苏贾前线
17,9159818,吴艳妮全锦赛夺冠
18,9148819,2024原神生日会
19,9106969,雪迷宫二金为护女儿做证人
20,9060009,今年的秋台风为何如此频繁
21,8921608,古人原来这样过中秋
22,8868335,这中秋细糠我先吃了
23,8738625,谁懂四位转7圈的含金量
24,8623056,当千里江山图遇上中秋月圆
25,8619941,央视曝光055大驱与强敌电磁战
26,8469705,库里一场训练要整多少花活
27,8454774,周杰伦演唱会小孩哥回应唱哭
28,8361231,苏州大树被刮倒砸中外卖员
29,8259518,光遇秋宵节
30,8208177,村里的中秋月圆人圆
31,8008456,黄一山悼念徐少强
32,8003029,国庆前或将一周一个台风
33,7957003,满级小孩玩说唱
34,7932407,中秋超级月亮最佳观赏时间
35,7924103,中秋宅家必看的视频
36,7828586,受台风影响南京多家景区闭园
37,7758890,流水迢迢 生理性喜欢
38,7756839,台风贝碧嘉的威力有多大
39,7744831,用一首歌温暖分手的室友
40,7744684,王者S37赛季即将开启
41,7738864,小圆满就很好
42,7713359,新一届香港小姐出炉
43,7706424,晒晒今年陪我看月亮的人
44,7701572,哈尔滨也太多小飞虫了
45,7660436,请跑到终点再哭
46,7659558,爆改黑神话还是太超前了
47,7651266,朝着圆月走
48,7649468,马竞3比0瓦伦西亚
49,7643274,解放军“空中大脑”有多牛
50,7642021,呲牙舞
