index,hot,title,href
1,11670943,官方鼓励安排职工除夕休息
2,11663663,微短剧7.9公里每秒
3,11461207,这群中国蓝盔回家了
4,11212592,3娃非亲生案开庭日是结婚纪念日
5,11001621,保温杯使用的5个禁忌
6,10965575,学生时代的时间都去哪了
7,10422179,C罗中国行首轮开票2分钟售罄
8,9736407,胡中明王文全晋升上将军衔
9,9702559,广州辟谣将限制外卖配送
10,9602624,大学老师为了捞人有多努力
11,9547553,律师：订婚不影响强奸罪定性
12,9507485,订婚强奸案审判长披露详情
13,9344518,魏晨回艾利斯顿路演了
14,9278925,看完三大队想约兄弟喝顿酒
15,9247752,大爷救出被冻在冰面的天鹅宝宝
16,9240455,鸣龙少年高校是雷鸣的底牌
17,9164760,张艺兴入职国家话剧院
18,9149888,致游客滑雪身亡的粉雪是什么
19,9093759,庆余年2预约破900万
20,9063082,狗子也怕告状
21,9054914,留学生回国后的报复性行为
22,9043336,电影潜行首映礼
23,9033544,挑战改造闺蜜
24,9031666,桃子老师每场直播收入仅千元
25,8982637,刘德华回应翻栏杆互动
26,8974885,权志龙为毒品防治捐3亿韩元
27,8926918,黄子韬徐艺洋被全场起哄
28,8919633,万茜气质好温柔
29,8904880,订婚强奸案男子一审判三年
30,8822403,28亿外包环卫却除不干净雪
31,8804590,日本将推出性同意APP
32,8798177,图灵奖得主预测未来
33,8744038,累是你的谎言
34,8733912,当显眼包和油腻男成为情侣
35,8714102,2023抖音年度观察报告
36,8706820,董宇辉新公司控股公司法人是孙东旭
37,8642588,雷军：将重新定义汽车工业技术栈
38,8581007,塞尔维亚感谢俄方情报预警
39,8579543,其实我热情似火
40,8555240,班级里的各种人
41,8546206,送别早餐奶奶毛师花
42,8423303,你俩是不是在里面偷牵手
43,8352185,和对象吵架吵成万人大辩论
44,8345376,2023NBA年终大战
45,8328591,解救GGbond翻唱
46,8265875,外交部：春节是中国的也是世界的
47,8102778,今日立志
48,8025709,胡锡进：游戏业不要慌
49,7987461,TES战胜WE
50,7984274,你曾被哪些暖评触动过
