index,hot,title,href
1,11610955,中国女排战胜美国
2,11580076,朝鲜组合晋级混双决赛
3,11489035,全抖音都在为奥运健儿加油
4,11152359,王楚钦孙颖莎晋级混双决赛
5,10556550,北京暴雨
6,10511484,苏炜德赛后道歉
7,9398553,Lady Gaga订婚了
8,9389559,李小鹏谈苏炜德两次掉杠
9,9372174,中国体操男团摘银
10,9358082,海淀很潮
11,9313587,盛李豪破奥运纪录再夺金
12,9170274,中国跳水队历届奥运金牌回顾
13,9162186,山东19万文科生滑档系谣言
14,9150667,王源被白纱报复了
15,8708608,陈若琳和郭晶晶相拥分享喜悦
16,8654677,黄雨婷女子10米气步枪摘银
17,8194857,和全红婵互关是种什么体验
18,8144688,为什么湖南成了暴雨中心
19,7843207,法国为什么这么癫
20,7828883,现场看巨星篮球赛是什么体验
21,7821947,苏炜德连续两次重大失误
22,7794124,徐嘉余夺100米仰泳银牌
23,7741618,蹦蹦吧蹦蹦吧
24,7729072,意想不到的片尾闯进奥运了
25,7716057,唐钱婷100米蛙泳摘银
26,7702687,打台球实力派选手申请出战
27,7699305,中国香港第2金
28,7696832,死侍超燃Bye Bye Bye舞蹈
29,7682259,乒乓奶奶希望孙颖莎为中国再添金
30,7676608,我的公路旅行要像风一样自由
31,7665682,开最灿烂的花 做最耀眼的火
32,7662140,用极致对称打开本命角色
33,7658545,搞笑只是我的伪装
34,7654368,大时代舞蹈挑战
35,7652587,孙颖莎冲击大满贯
36,7645253,八月我会招来什么
37,7644492,打包你的行李跟我去兜风
38,7643216,心情忐忑 就去养只爱你的猫
39,7642393,摇摇手机变身挑战
40,7637783,一种很新的试衣服方式
41,7635103,孙杨说自己经历了重生
42,7632451,倪夏莲和孙颖莎相差38岁
43,7626958,七夕那天你会收到什么
44,7626426,懒羊羊从来不内耗
45,7624858,樊振东4:0扎穆登科
46,7617333,相机喜欢镜头前的每一个故事
47,7612063,眼睛是灵魂交流的窗口
48,7611866,大哭包生了个小哭包
49,7595628,紫色跑道的city穿搭
50,7416905,让我们从此并肩看晚霞
