index,hot,title,href
1,11342686,美军接连重启二战时期旧基地
2,11262688,国足2:1印尼
3,11049872,我国宣布将开展地外生命探寻
4,10980858,韩军向军事分界线以南应对射击
5,10283338,王楚钦孙颖莎王曼昱退出全锦赛
6,10069069,天津取消住房限购
7,8970559,王毅同以伊外长通话的背后
8,8815857,林高远刘诗雯全锦赛混双夺冠
9,8782960,张玉宁回应落泪
10,8458157,广东男篮两连败
11,8413349,国考报名信息填写指南
12,8321025,时髦精的轻暖感穿搭
13,8259848,曾凡博双手大帽
14,8234820,警惕新疆库车地震相关谣言
15,8041644,外交部谈半岛局势
16,8037214,字母哥发抖音了
17,7946714,中国印钞造币官方来抖音了
18,7871379,WSUP全球齐舞大赛
19,7856856,睢冉说柯冉打不了职业
20,7849184,国际问题学者解读半岛局势
21,7798577,朝鲜炸毁朝韩连接路段
22,7796486,你啰嗦了
23,7770050,全红婵陈芋汐恢复训练
24,7747296,印尼球员说国足浪费时间
25,7741697,张玉宁进球落泪
26,7735814,黄雨婷创造新世界纪录摘金
27,7724618,我是个坚强笨女人
28,7704619,警方回应女孩被同学打的满嘴是血
29,7702675,谢瑜男子10米气手枪折桂
30,7701525,明星版派对前夜运镜
31,7699222,还原韩剧对视名场面
32,7697466,王健林清空美国传奇影业股权
33,7695798,用秋叶做的花束好浪漫
34,7694591,一猫一歌的梦想实现了
35,7689903,孙莉跳舞模仿大赛
36,7686741,如何评价vivoX200
37,7682327,苹果四折叠屏手机专利曝光
38,7682175,是什么让彼此选择做好朋友
39,7681597,又一波贷款入市“吃亏者”出现
40,7681177,我知道你暗恋我
41,7673645,得不到的就更加爱
42,7671799,盛李豪世界杯夺冠
43,7662065,拜合拉木破门
44,7660601,尹锡悦不支持率创新高
45,7658591,和瘦子在一起是什么体验
46,7655330,王者草木风华全员初亮相
47,7651813,扫一扫脸型配发型
48,7649932,lovemoneyfame舞蹈挑战
49,7648972,德国队为4位球员举办退役仪式
50,7647321,小蜜蜂判官出现了
