index,hot,title,href
1,11176648,土台风预计31日夜间登陆广东
2,10377781,2024年新一线城市排名来了
3,10343095,一代代科技工作者续写家国情怀
4,10107865,14名反中乱港分子被裁定罪名成立
5,9558941,今年快过去一半了
6,9492310,特朗普被控34项重罪成立
7,8445062,六一的快乐因子已提前超标
8,8434919,体育总局原局长苟仲文被查
9,8430154,庆余年2大结局
10,8401031,青春没有售价 铁腚直达拉萨
11,8396244,用莫奈花园诠释夏天
12,8386110,范闲海棠朵朵重逢
13,8385105,O型血更招蚊子系谣言
14,8380439,半个娱乐圈都在上海了
15,8374511,斯洛伐克遇刺总理出院
16,8317333,完美世界三石迎战宁川
17,8275228,叶轻眉还担心冰雪大世界生意
18,8263173,高三老师把英语听力换成起风了
19,8245240,植物大战僵尸杂交版
20,8199643,张志磊VS维尔德
21,8199605,老家伙现实版扶不扶
22,8171669,女子爆改爷爷留下的结婚证
23,8154852,被家暴16次女子又遭夫家威胁
24,8109229,五月最后一天
25,8097695,车评人向周鸿祎“开炮”
26,8064308,王者体验服全英雄调整
27,8042805,媒体评武大选调生离职
28,8030519,好友披露女留学生坠亡前细节
29,8028765,红十字会回应直升机送烤全羊
30,8001968,范闲身世曝光
31,7982020,普华永道在中国连丢大单
32,7969975,庆余年四大宗师谁更强
33,7952447,自媒体博主因造谣向小米致歉
34,7905773,炎亚纶被判7个月缓刑3年
35,7904408,金铲铲双城传说正式回归
36,7891517,我的梦想 我的森林北
37,7877707,庆余年2悬空庙神仙局真相
38,7877484,拜登反问记者：你脑子没事吧
39,7861048,被家暴16次女子最新发声
40,7858822,人民日报评“禁止蕉绿”走红原因
41,7828574,第29届白玉兰奖入围名单
42,7814577,五月快过完了
43,7801884,记者直击乌军反击哈尔科夫
44,7792979,100个健身的理由
45,7790643,定格在温情瞬间
46,7788466,蜥蜴烫脚模仿大赛
47,7772216,宴请小时候的自己
48,7768922,大学生写毕业论文现状
49,7745732,希尔顿扣罚押金是否合法合规
50,7740042,再见叙利亚卖纸巾的老爷爷
