index,hot,title,href
1,12189982,覃海洋100米蛙泳决赛第7
2,12117752,美国男篮110:84塞尔维亚
3,12023575,中国“00后”神枪手养成记
4,11996851,张雨霏100米蝶泳收获铜牌
5,11313696,王楚钦孙颖莎晋级四强
6,11229600,现场见证中国队夺金时刻
7,9819387,湘潭县涓水一处堤段出现决口
8,9773294,巴黎奥运会第三个比赛日看点
9,9744947,巴黎奥运赞助商回应撤资
10,9717415,田志希爆冷出局
11,9591390,学生玩梗被老师收回优秀证书
12,9541556,大杀器杜兰特
13,9447719,喀纳斯景区辟谣有人被熊追逐
14,9210763,中国女篮不敌西班牙
15,9191497,杨倩送董宇辉清华毕业熊猫
16,9165101,姚明场边大喊：不要犯规
17,9084129,巴黎暴雨多地区大面积停电
18,8902230,朝鲜队教练嘴角压不住了
19,8841707,沉浸式感受火把节
20,8793632,谢瑜男子10米气手枪夺冠
21,8550312,奥运会官号删除巴黎开幕式视频
22,8250210,周末的松弛感拉满了
23,7993536,再听一遍青花瓷 敬我们初相识
24,7981522,这样的漂流也太有趣了
25,7842275,古人的审美能力
26,7816889,摇摇手机变身挑战
27,7796033,奥运开幕式果盘已next level
28,7741997,苏炳添说自己达不到国家队标准
29,7738825,一首歌变着花样的火
30,7720838,半个抖音集体告别长相思
31,7696316,矿泉水烟花next level
32,7687699,这狗太懂事了
33,7687343,中央气象台对台风格美停止编号
34,7686259,给Lady Gaga表演换个音频
35,7685093,当今天你要嫁给我的前奏响起
36,7679837,孙杨400米自由泳纪录未被打破
37,7679593,狗子吃了我的遮瑕
38,7678997,眼睛是灵魂交流的窗口
39,7664810,轻舟渡离万重山
40,7662458,黄雨婷冲击本届个人第二金
41,7642188,乌军突袭克里米亚俄军机场
42,7639875,2024电竞世界杯和平精英总决赛
43,7632436,孙颖莎不到半小时决胜对手
44,7630844,不求人单挑杯决赛北子vs灵君
45,7626241,感受一下音乐节现场感染力
46,7625555,巴黎奥运将南苏丹国歌放错
47,7617334,魏晨大同音乐节
48,7614662,王毅严厉驳斥个别国家
49,7611075,王楚钦孙颖莎谈日本混双出局
50,7577412,谷爱凌：中国队夺金表现精彩
