index,hot,title,href
1,11086608,猛龙球员波特涉赌被终身禁赛
2,11010204,长城炮是什么梗
3,10939433,中国获巴黎奥运165项参赛资格
4,10857040,周鸿祎称卖迈巴赫买国产新能源
5,10228627,利物浦无缘欧联杯四强
6,10154640,广东120:100广厦
7,9047706,专家鼓励下铺年轻人跟老人换位
8,8931269,美国一票否决巴勒斯坦入联申请
9,8908883,市委书记买官被骗500万
10,8904083,男子酒后骚扰女孩还打家长
11,8885341,董宇辉首次参加北京电影节
12,8802877,福州发生航空器事故系谣言
13,8801336,周杰伦大莲花开唱
14,8716245,雷军辟谣高考状元
15,8714776,胡歌高圆圆同框
16,8595608,伊朗：已准备好回应以色列袭击
17,8589913,王珞丹妈妈道歉了
18,8570926,雷军硬控小孩哥
19,8528977,惜花芷28集封神
20,8447128,肯尼亚国防军司令坠机身亡
21,8407833,杨紫用5:20睡觉给我表白了
22,8385226,姑父强奸猥亵侄女7年被判13年
23,8303703,反对调休的声音不能装作听不到
24,8261981,你信我手上有两块小蛋糕吗
25,8221276,孔雀哥在城中之城搞纯爱
26,8206939,小伙退房遭中介提灯定损
27,8200897,武艺终于发飙了
28,8185228,拜登称舅舅二战中被食人族吃掉
29,8176519,承欢记直球男女主
30,8151936,临沂文旅杀疯了
31,8070595,胡可解答沙溢瘦了20斤的原因
32,8023257,今日谷雨  万物逢时
33,8005503,五一假期热门旅游目的地
34,7979917,五一出游穿搭已经准备好啦
35,7919846,中使馆回应中国公民在菲被捕
36,7790669,9岁男孩上学前跳楼身亡
37,7722081,雷军发布会后首次直播
38,7706230,拍下这里的春天
39,7667498,最治愈的便是这世间的山水
40,7667164,麒麟9010跑分出炉
41,7657005,多国开启货币保卫战意味着什么
42,7641440,一次酣畅淋漓的窝囊转场
43,7640254,青岛农业大学的小马
44,7619776,来葛仙村找干娘脱单
45,7615656,我的变装易如反掌
46,7589974,邓紫棋佛山演唱会
47,7587151,全网都在唱求神
48,7580676,来一场春日cityplay
49,7578611,著名经济学家胡必亮逝世
50,7578583,春天当然要出门“沾花惹草”
