index,hot,title,href
1,10903403,母亲节快乐
2,10201202,母亲节向妈妈告白
3,10136503,匈中双语学校见证中匈友谊
4,10135326,走进汶川地震遗址
5,9571662,祝妈妈节日快乐的一百种方式
6,9507983,南通交通事故网民有两个关切点
7,8450583,祝你毕业快乐 祝你永远平安喜乐
8,8393899,王楚钦男单夺冠
9,8387695,官方回应执法人员“碰瓷式执法”
10,8387533,南通学生大巴事故一女孩离世
11,8346099,谁来救救那英
12,8331762,官方辟谣“藏水入疆”工程
13,8309812,汶川地震16年了
14,8307269,南通致1死大巴事故原因查明
15,8285736,张予曦寸头照
16,8272738,郭碧婷爆改东北郭姐
17,8271345,警方通报信阳女孩遭多人霸凌
18,8268377,辽宁男篮淘汰广东晋级总决赛
19,8264572,宁静为剪了赵奕欢的戏道歉
20,8246767,教师称被家长要求改学生成绩
21,8213771,会说话的刘二豆复更
22,8207798,压力给到凤凰传奇
23,8206562,火影忍者秽土解斑全爆料
24,8177428,46岁王晶街霸砍20分
25,8176697,胡歌新片偷感太重了
26,8154523,当我第一次给妈妈洗脚
27,8151406,邓超被范志毅吐槽听不懂上海话
28,8116824,断眉抖音评论区
29,8041827,91岁婆婆坠下4楼生还
30,8033180,马克龙喊话皇马
31,8031291,王楚钦：赛程密集很难不疲劳
32,7969000,菏泽文旅终于出手了
33,7918793,歌手2024外国选手表情
34,7894726,丁太升辣评歌手第一期
35,7883263,外国友人试图理解东北文化
36,7846396,汪苏泷回应排名第四
37,7839849,母亲节手势舞
38,7810966,苏有朋北京演唱会
39,7780599,郭有才喊你来菏泽玩
40,7705076,陈梦4:2孙颖莎夺冠
41,7622720,你是否支持宠物上高铁
42,7598471,环球时报评中日韩峰会
43,7571060,火车站穹顶到底藏了多少惊喜
44,7569454,GEN战胜TES
45,7564894,李显龙卸任前哽咽寄语年轻人
46,7556359,我拍到极光了
47,7530076,爱乐之城双人舞挑战
48,7529255,妈妈不是家务劳动的默认责任人
49,7528436,献给妈妈的一首歌
50,7526364,合肥肥东3.1级地震
