index,hot,title,href
1,11518815,日本小林制药召回约30万份产品
2,11276738,莫斯科恐袭救援结束
3,10687423,解锁打开春天的N种方式
4,10612158,英格兰0比1巴西
5,10518036,村BA非遗民族秀惊艳全场
6,10472024,哈特千分大战暴扣
7,10344187,王大雷：我们就像球迷的孩子
8,10290017,第十二届中式台球大师赛总决赛
9,10232380,全国教育辟谣平台来了
10,10187997,“伊斯兰国”发袭击第一视角视频
11,10156374,美国强烈谴责俄恐袭事件
12,10143812,哈特暴走打哭日本街球手
13,10115817,莫斯科恐袭事件11人被捕
14,9912961,莫斯科恐袭已致143人遇难
15,9911962,南航大学回应学生与教授发生关系
16,9704563,普京：幕后黑手都将受到惩罚
17,9361148,当我在国外想吃天水麻辣烫
18,9302075,中国仪仗兵亮相巴基斯坦阅兵场
19,9191301,农夫山泉再回应公益捐赠传闻
20,9178817,小日子演员集体发抖音
21,9100167,有人钢枪有人伏地是什么梗
22,9046277,纪凌尘拍喜剧拍emo了
23,9018674,赵露思澳门活动造型
24,8954170,刘畊宏教你用小区健身器械
25,8928413,eStar首发女选手登场
26,8888824,商场回应情侣霸占母婴室
27,8855891,奚梦瑶何猷君带妹妹现身活动
28,8844659,菲船只非法闯入被中国海警依法管制
29,8812273,是谁住在广阔的小麦地里
30,8733228,人间四月流苏雪
31,8623738,王楚钦退赛李元璋递补
32,8619560,PRX晋级败者组决赛
33,8565231,建议南方饭店把婆婆丁纳入菜单
34,8551413,香港阿Sir队村超行
35,8428789,张志磊新比赛敲定
36,8426687,张照洋干呕式喊话X战队
37,8406429,女子回应被指蹭王婆流量
38,8389406,沈腾马丽成中国票房最高男女主演
39,8256024,贵人鸟公告退市
40,8205091,天水竟然这么多特产
41,8175009,拉塞尔詹姆斯比翼双飞
42,8056034,马刺2分惜败灰熊
43,8019928,朱迅参加无锡马拉松
44,7994038,勇士111:123不敌步行者
45,7839717,万妮达雪碧黄瓜虾滑制作教程
46,7815129,联合国谴责莫斯科恐怖袭击
47,7782451,中方：强烈谴责恐怖袭击行为
48,7754152,湖人战胜76人
49,7713679,云南打歌舞的风吹到了幼儿园
50,7632896,民间第一亚索追风少年
