index,hot,title,href
1,12108766,北京宣言意味着什么
2,12064611,台风格美将迎爆发式加强
3,11801529,全国教育经费投入超6.4万亿
4,11351466,或超10亿人收看巴黎奥运会开幕式
5,10755004,北京将持续降雨约30小时
6,10639324,直击台风格美路径
7,9429951,全国都在上班凉山像在过年
8,9372808,光遇二重奏季攻略
9,9357264,暑假快过去一半了
10,9208910,当我决定自驾环游中国
11,9197380,不变的是彼此的友谊
12,9167063,你生前的信如约而至
13,9137301,吴谨言仿妆宁静
14,9050194,济南遭遇特大暴雨系谣言
15,8879972,浙江多地紧急撤离游客
16,8860615,雷军回应网友建议接商单补贴家用
17,8830649,男子阿勒泰疑发现石油实为沥青
18,8760389,昆明广告牌坠落已致3死7伤
19,8732690,外交部回应北京宣言
20,8658852,三伏天晒背警惕热射病
21,8593942,韦世豪晒图疑似暗讽足协追罚
22,8419817,见到了独孤信的多面体煤精组印
23,8380294,郭婷婷任财政部副部长
24,8375321,俄预计将攻下乌又一关键城市
25,8227107,官方回应郑州一男子积水中倒地
26,8159213,爆改弟弟
27,8117848,基地回应有人朝福宝扔折叠椅
28,7971636,台风格美或致停工停课
29,7834096,澳驱逐舰击沉美退役战舰
30,7806633,美国国会大厦降半旗真相
31,7802615,鸡JioJio鸡JioJio
32,7796033,当地回应宁夏网红杀妻后自杀
33,7751971,“雪糕刺客”退场了吗
34,7739607,用AI拥抱相柳
35,7717510,相柳战死评论区
36,7716963,美联储或将删除对通胀高企的描述
37,7709429,永劫无间手游开启预下载
38,7705324,宗老给宗馥莉留了什么底牌
39,7689986,法塔赫和哈马斯达成北京宣言
40,7682895,我用一生等你 你不来我不老
41,7681916,当我跟闺蜜嫁进一家
42,7675941,穿越时空的拥抱
43,7660023,到底是谁在唱红尘客栈啊
44,7659693,我做了一个梦 我梦见
45,7647607,没有班味的通勤穿搭
46,7644715,要像爱花一样爱自己
47,7643772,反正路也要一个人走
48,7643293,中央研究开征“地方附加税”
49,7642857,第一次见打拳击的玛卡巴卡
50,7637587,RW零封TCG晋级S组
