index,hot,title,href
1,11059374,中方：以须停止进攻拉法
2,10780695,伊朗总统遗体运抵德黑兰
3,10736691,港珠澳大桥出入境客流破纪录
4,10485083,台媒：赖清德阻绝两岸良性对话之路
5,9879604,宋金达将访华
6,9734715,外国人自驾游中国
7,8622557,王婆说媒出圈背后谁是赢家
8,8407486,DNF手游评分
9,8375608,该学会包粽子了
10,8354945,长相守到白头山为证
11,8342049,舒淇被挤
12,8318852,警惕五大求职骗局
13,8318160,克罗斯官宣退役
14,8316518,官方回应公职人员出轨已婚校友
15,8284314,唐山市人大常委会主任杨洁被查
16,8238409,Jennie曾拒绝李胜利的邀请
17,8213849,陈飞宇杀回现偶
18,8203379,英首相就污血丑闻致歉
19,8182842,郭麒麟拍了四天戏跪了三回
20,8153878,汪峰承认与森林北恋情
21,8103333,2024年第一位登天都峰游客
22,8046761,鸣潮开启预下载
23,8044513,疯产姐妹 回来了但没完全回来
24,8043402,新加坡客机迫降曼谷致2死30伤
25,8015839,王婆说媒已婚相亲男现已离婚
26,8010336,陈丽萍被决定逮捕
27,7976612,爬一爬刚刚开放的天都峰
28,7962948,袁隆平逝世三周年
29,7926006,俄罗斯现海市蜃楼
30,7912563,刘亦菲安妮海瑟薇同框热聊
31,7870055,庆余年2公主大皇子是纯爱
32,7863363,四川5死车祸监控画面曝光
33,7729371,惠州一河流水体变红色有鱼死亡
34,7721582,警方通报小轿车碰撞路人致5死
35,7689135,幸福的印记又多了一项
36,7678616,疯产姐妹回来了
37,7657085,谁拿走了吴彦祖的外卖
38,7655950,刘德华17岁合唱挑战
39,7653638,俄罗斯决定临时恢复汽油出口
40,7622704,想拍自己最胖的时候
41,7622140,买房的好时机到了吗
42,7605377,如何正确驱赶隐翅虫
43,7604720,喜欢书法让人静心
44,7600393,台词一说还真是那个味
45,7596102,召唤蝴蝶特效
46,7593226,河南人回来收麦了
47,7590470,奔跑吧全员美式校园风
48,7587395,真正的年轻是怎样的
49,7584991,FF股价暴涨的背后
50,7582191,什么视频配上这音乐都会伤感吗
