index,hot,title,href
1,11569294,iOS 18将迎苹果史上最大革新
2,11284440,王小军被撤销全国政协委员资格
3,10853257,何以中国向海泉州
4,10514167,当伴娘那天我体验了无数种职业
5,10475516,这狗子好像有路怒症
6,10296866,内马尔变肉马尔了
7,10243147,十二钗十二椅十二悲十二碑
8,10123188,新一轮暴雪会影响春运吗
9,10033717,官方辟谣上海松江发生爆炸
10,10011657,新疆阿合奇5.7级地震
11,9985267,梅尼耶当伴郎
12,9856420,下雨了猴哥也急着回家
13,9655062,oi 这里还有一只小熊
14,9593918,山西最大煤企原董事长出镜忏悔
15,9467787,新年穿戴甲合集
16,9397715,订婚强奸案男子起诉
17,9371794,河南将迎暴雪
18,9350633,00后真是各过各的
19,9329752,童年的子弹此刻正中我眉心
20,9318999,范丞丞剧中偷看杨紫眼神
21,9314039,运三车东北的雪到广州
22,9284634,最特别的写字楼广告位
23,9266116,云台山真的把大圆哥喊来了
24,9203247,童年的快乐是爷爷给的
25,9108754,王者新英雄敖隐
26,9045194,飞驰2发布会喜剧人都来了
27,9045086,易烊千玺新闻联播镜头
28,9020294,周星驰喊大家来抖音看短剧
29,8998353,被东北农村美食馋哭了
30,8986401,高德地图客服回应崩了
31,8983576,官方回应企业悬赏百万征集线索
32,8979414,得州冲突为何对特朗普有利
33,8964227,就在此刻看镜头挑战
34,8963965,小朋友都知道给对方台阶下
35,8929180,恒大回应清盘令
36,8905688,美网民：得州独立会怎样
37,8802719,普京被登记为俄总统候选人
38,8775746,乡爱16刘能瘫了
39,8766991,Super Lady舞蹈我先跳
40,8748328,杜特尔特公开对马科斯爆粗口
41,8733134,火龙果要种多久才能开花
42,8700634,家有双胞胎是什么体验
43,8698497,带老外过中国年
44,8674409,小伙欠债40万女友陪还4年
45,8663568,伊拉克2:3约旦
46,8619468,2024年已有5虎被查
47,8554566,黄瀛子蒋翼今晚好虐
48,8529907,檀健次吉祥龙帽手势舞
49,8529189,萌娃过年技能专项训练
50,8519920,苦等32年 父亲与被拐儿女团圆
