index,hot,title,href
1,12121047,勿忘国耻警钟长鸣
2,12094640,黎巴嫩寻呼机爆炸9死2800伤
3,12006323,小圆满就很好
4,11791188,九一八事变爆发93周年
5,10899019,教育部原副部长杜玉波被查
6,10895377,美联储降息如何影响普通人
7,9744199,皇马3:1力克斯图加特
8,9729989,军训好像也没那么可怕
9,9451449,唐嫣李现合唱若月亮没来
10,9424328,上海申花4:1逆转浦项制铁
11,9416950,美军机过航台海 解放军跟监警戒
12,9368634,BGM放完了你们的幸福还在继续
13,9297247,iOS 18还我妈生相册
14,9255038,无锡警方辟谣男子街头触电身亡
15,9126994,托卡耶夫：俄在军事上不可战胜
16,9124045,张踩铃想签约刘美含妈妈
17,9093691,米兰1:3遭利物浦逆转
18,9066130,河南的腐乳肉有多绝
19,9030332,登陆我国台风强度有增强趋势
20,8999885,李大海重逢初恋白霜
21,8990720,胡明轩担任中国男篮队长
22,8614820,红军城成俄乌争夺焦点
23,8553548,陈乔恩晒粉色天空悼念乔任梁
24,7876247,王楚然敦煌造型好惊艳
25,7803941,泰国坠崖案当事人官宣生子
26,7795840,台风普拉桑将登陆浙江沿海
27,7775562,赵露思新中式造型
28,7725751,花好月圆过中秋
29,7725454,美再度宣布对台军售
30,7717888,对手挑衅球迷 王大雷上前理论
31,7715173,梁王组合又偷后场了
32,7704340,模仿西部牛仔对决
33,7702971,港股地产股全线暴涨
34,7689642,那艺娜26个字母歌
35,7666414,年轻人vs阿斯顿维拉
36,7662472,obgg显示yagao正在审批
37,7658448,马斯克就特朗普事件发文后删除
38,7656156,台风来了都得干活才能走
39,7655218,就借这月光再与你对望
40,7639930,孙颖莎9400分世排第一
41,7638483,你就是太在意别人的看法了
42,7638307,本周国内油价有望大幅下调
43,7632150,用这个特效晒出中秋月圆合照
44,7631304,不养狗不知道养狗的乐趣
45,7627692,收集一本月亮集
46,7623751,贝加尔湖畔最真实的样子
47,7620416,第一次看到鱼打架
48,7619948,国际乒联第38周排名公布
49,7616929,分享一下我的中秋快乐碎片
50,7612592,古诗里的中秋什么样
