index,hot,title,href
1,10896468,嫦娥六号着陆月球背面
2,10782136,皇马第15次夺得欧冠冠军
3,10723101,数说世界最大清洁能源走廊
4,10598428,张志磊vs维尔德
5,9936008,六一是成年人的gap day
6,9924194,爱自己的100种方式又回来了
7,8745438,一栗小莎子官宣生子
8,7875336,女排教练
9,7814811,春秋航空的空调有多凉
10,7737122,巴基斯坦总理：巴中亲如铁杆兄弟
11,7696953,王俊凯周杰伦合唱稻香
12,7692364,严查汪苏泷精神状态
13,7673450,亚当：我很快就回来
14,7653003,原来这些儿童健康偏方是假的
15,7645005,我们这一路走来不容易
16,7637896,洛丽塔是现实罪恶的挡箭牌吗
17,7622558,想和最好的闺蜜一起去骑马
18,7620759,粽子的多种包法
19,7600379,陶喆开嗓又是一代人的回忆
20,7599276,朱婷首发 中国女排3:0泰国队
21,7597970,匈总理：欧进入对俄开战准备阶段
22,7592689,宝宝：你过六一还是我过六一啊
23,7580375,中方回应美防长涉台言论
24,7580135,回忆杀cos挑战
25,7578223,我都有点爱上叶轻眉了
26,7576456,官方通报怀孕大学生被误诊身亡
27,7573876,莫德里奇入驻抖音为皇马加油
28,7567895,梁靖崑3:2淘汰勒布伦
29,7566902,周楷恒爆砍48分率队四连胜
30,7566679,张志磊呼吁大家理性购票
31,7566066,王暖暖再为人母
32,7559471,xiye入驻抖音
33,7558807,EDG不敌PRX惨遭淘汰
34,7557055,当外国人看到变脸表演
35,7556511,这么忠实的粉丝竟然有两个
36,7555031,小智约战芜湖神
37,7552646,郑钦文遭误判
38,7550351,许嵩南京演唱会
39,7549878,被刘雨昕唱跳舞台硬控了
40,7549574,刘宪华昆明音乐节
41,7543678,六一最好笑的是父母
42,7540174,祝我相册里的小孩节日快乐
43,7537989,我和我的怨种小猫咪
44,7533188,Enhypen 02z汪喵拳
45,7531055,加沙儿童六一得到的是轰炸
46,7530593,GQ红毯串词好幽默
47,7530027,猫猫打招呼泥嚎
48,7529349,雷军余承东李斌同框
49,7528543,王曼昱3:0平野美宇
50,7528209,用AI穿越奇妙毛毡世界
