index,hot,title,href
1,10309764,长津湖战役胜利日
2,10129019,台湾小学校庆集体跳科目三
3,9699342,2023那些治愈我们的瞬间
4,9481883,泡东北室外温泉是什么体验
5,9457726,黄绮珊：没孩子是人生遗憾
6,9453237,公主请告别2023
7,9302249,河北滦州2.8级地震
8,9296593,爸爸别把我作业吃了
9,9281071,甘肃红会辟谣“高价采购清单”
10,9273832,怎么跟烟花合照
11,9180708,让AI写真来亿点颜值震撼
12,9171461,苦瓜脸生了一堆小苦瓜
13,9165494,新年撒花变装
14,9145441,我只是爱嘴上输出
15,9144436,全国大部地区将回暖
16,9103631,5角钱早餐奶奶去世
17,9089324,三大队程兵轻舟已过万重山
18,9046976,马斯克成2023全球最能赚钱者
19,8860953,大脑失眠部门
20,8859746,祝你平安
21,8855365,当你和领导有代沟
22,8791706,2023活力满满的特种兵旅行
23,8703287,日本拟将大陆架延伸12万平方公里
24,8560591,管泽元余霜婚礼
25,8556777,Jennie成立个人厂牌
26,8473000,新世界是属于大女主的
27,8424528,我的军师可能想辞职了
28,8381154,解清帅回应直播带货
29,8364560,10元以下的面包正在消失
30,8363504,考研结束的那一刻
31,8351782,杨洋素颜合照
32,8245153,朱令讣告
33,8223267,张大仙收到五千万粉丝奖杯
34,7930288,小孩哥勇救坠楼小猫
35,7889759,伊朗将领：地中海可能被关闭
36,7869552,数学突然开窍是什么感觉
37,7803643,X战队vs瓷器厂
38,7789322,95平米老房有游乐场有密室
39,7715847,中国女子在日本滑雪时去世
40,7695498,毛毛姐陪阿姨拿房本
41,7662640,谁懂这首胡广生的故事感
42,7559408,鸣龙少年里的热烈青春
43,7515926,哈尔滨洗浴被远方客人攻占
44,7480018,嗑到了海王和弟弟的兄弟情
45,7467388,刘德华潜行路演翻过栏杆互动
46,7404204,第一次体验滑雪
47,7339330,跨年夜和姐妹就这样拍吧
48,7295915,良田直面容貌焦虑
49,7211394,AG对战狼队
50,7204635,迟来的爱
