index,hot,title,href
1,11199848,德国2:0匈牙利提前出线
2,10437717,中国4月增持美债33亿美元
3,10235256,首个工业用途核能供汽项目投产
4,10176081,苏格兰1:1瑞士
5,9603070,穆夏拉打破僵局
6,9576768,京多安打进个人欧洲杯首球
7,8568252,南方强降雨影响有多严重
8,8464493,全球首台“人造太阳”建成运行
9,8442103,导师发了个免责声明
10,8398829,桂林暴雨 火车站被淹
11,8394778,全国28省份公布高考出分时间
12,8392644,内娱恋综有自己的海王
13,8388151,盘点十大食品安全谣言
14,8378583,曝陈晓陈妍希婚姻破裂
15,8360524,残疾夫妇砸西瓜摊主倒赔500
16,8341304,家长举报女儿被老师扇耳光致失聪
17,8340811,克罗地亚2:2阿尔巴尼亚
18,8323481,玫瑰的故事傅家明上线
19,8060490,赵丽颖抖音评论区
20,8010135,普京抵达越南进行国事访问
21,7980861,中国海警登检菲船只画面
22,7979188,林更新：骂方协文别带我名
23,7922612,中奖500万无人领成弃奖
24,7799928,冷藏车载8人窒息身亡背后
25,7721183,动物怎么叫游戏挑战
26,7686705,姐以前也很潇洒
27,7674932,普京称赞平壤整洁美丽
28,7666743,老伴去世老人发现墓地被家人卖了
29,7654780,“外交豁免权”是什么
30,7639715,吕迪格是德国喜剧人吧
31,7635851,腾讯对多个渠道停止更新DNF手游
32,7622590,谁能镇住玫瑰婆婆
33,7622520,以军批准对黎巴嫩发动进攻计划
34,7622055,奔跑吧匈牙利录制路透
35,7620274,原来我们追求的早就给了我们
36,7610622,韩国宣布进入人口国家紧急状态
37,7604058,副本即将崩塌
38,7603931,桂林部分河流现20年一遇洪水
39,7603833,暑假工版野生315晚会
40,7603292,小猫是我的解药
41,7596546,逐客令舞蹈挑战
42,7591495,健身前vs健身后
43,7588026,愿向往幸福的同时也站在幸福里
44,7585591,精灵闪电是来自宇宙的烟火
45,7571511,我一定会肥透半边天
46,7560009,小朋友有自己的鞠躬方向
47,7559938,谁能懂何炅这个飞上去的拥抱
48,7555661,32岁孙杨无缘巴黎奥运会
49,7555548,中方支持阿根廷对马岛主权要求
50,7553382,罗小黑作者MTJJ回应争议
