index,hot,title,href
1,11685568,反腐专题片披露李铁案细节
2,11600933,董宇辉新号首播与7名主播亮相
3,11330636,东航C919执飞京沪航线
4,11201298,跟着繁花学穿搭
5,9830237,离别前奶奶一个动作让孙子破防
6,9690859,湖南小辣椒勇闯哈尔滨
7,9689043,邓紫棋视角的邓紫棋演唱会
8,9674417,冬日时髦不止美拉德
9,9499970,“医生免费治疗儿童被开除”不实
10,9443244,央视评繁花：可能会成为孤品
11,9376334,李铁的铁刘海为何还在
12,9298205,日本6.0级地震
13,9192109,俱乐部看到国足名单都脸红了
14,9182204,领导让开会准备水果
15,9159350,董宇辉新号刚开播就登榜首
16,9125389,姜爷爷又背上娃了
17,9122216,上市公司回应“胡歌”成股东
18,9093521,看完繁花大结局意难平
19,9092293,胡锡进谈李铁等出镜忏悔
20,9073653,起猛了以为董宇辉办春晚了
21,9063468,董宇辉新号与辉同行首播
22,9041562,见识到了南北方的差异
23,9037921,画兰花这么简单吗
24,9012191,李铁为上位国足主帅行贿300万
25,9010320,黄晓明诚挚邀请你来青岛
26,8984759,左右哥科普鄂伦春族
27,8976080,毒角SHOW在美国组建篮球厂牌
28,8914999,陈佩斯父子穿越13城变装
29,8891159,哈尔滨回应酒店加被子收费100
30,8890515,强生拟支付50亿和解费
31,8887543,范湉湉：戴军生日当天还在吊威亚
32,8877105,怪我们星座不太相配
33,8869336,东北人到底生气没
34,8835401,人民网评繁花
35,8808867,赵露思侧马尾卷发教程
36,8793094,劳斯莱斯一年卖了6032辆
37,8741854,压力给到河南文旅
38,8654391,以前vs现在的动画片
39,8613769,这个春节不如去趟云南
40,8603415,繁花大结局
41,8544807,左右哥脱口秀现场
42,8480394,撑场面的龙年穿搭
43,8332059,献礼警察节
44,8313941,上影现场胡歌狂飙上海话
45,8309073,2023电视剧荒谬场面大赏
46,8284087,张主任和安七炫是什么关系
47,8224616,萌娃滑雪有多酷
48,8115062,莫兰特将接受肩部手术赛季报销
49,8114936,社区要求返乡过年人员报备
50,8049933,被年会折腾的基层员工
