index,hot,title,href
1,11437506,香港立法会通过维护国家安全条例
2,11084667,淀粉肠老板的求生欲
3,9439273,春耕时节话农桑
4,9412179,春分时节正芬芳
5,9407142,西安交大学子挥手送别王树国校长
6,9374124,普京出席克里米亚入俄十年音乐会
7,9343089,当大学生想问妈妈多要点生活费
8,9341952,美国希望立即与中俄就军控对话
9,9254811,重庆辟谣南坪大楼火灾伤亡惨重
10,9198396,硬控四郎湘琴30秒
11,9160542,有人钢枪有人伏地魔性演绎大赛
12,9132541,赵丽颖与凤行有种淡淡的幽默
13,9105810,熊大熊二在阜阳
14,9081101,汽车在高校撞人已致3死16伤
15,9069207,超级草根险胜zooparty
16,8975302,李炮儿7天减重15斤
17,8975240,来自海洋巨无霸的压迫感
18,8966445,瑶一瑶跳云南打歌舞
19,8918962,小米汽车超级工厂正式揭幕
20,8917994,劳斯莱斯跨车道转弯逼停直行车
21,8902296,冕宁校园霸凌事件已刑事立案
22,8869208,被救者已看望溺亡小伙家属
23,8841203,大学教授课上讲爱情被网友蹭课
24,8839145,小米2023年净利润193亿
25,8792973,男子被猫绊倒投喂者赔钱合理吗
26,8739133,在大熊猫身上看到呼天抢地
27,8735167,全网都在唱蓝多多来了
28,8619051,能不能为你再跳一支舞
29,8585405,吴莫愁芜湖寻找麻辣烫
30,8547432,林书豪陷入禁药风波
31,8538288,马师傅首发上场两分钟
32,8524894,外交部发言人纠正外媒涉台提问
33,8464970,泼花成画挑战
34,8441677,驻京办干饭攻略
35,8438916,当地理老师学会打歌舞
36,8406633,男孩遭霸凌父母讨说法被踢出群
37,8399237,免胶假睫毛测评
38,8369283,送别眉山19岁救人英雄李政
39,8359341,无限超越班模仿大赛没有瓶颈期
40,8286124,今日春分 欣欣向荣
41,8285092,梦想之家来且了
42,8228157,狗狗也有狗狗座骑
43,8215518,花间令有自己的图书馆30秒
44,8149309,水利局回应农村装自来水每户3000
45,8143286,胡可三种鲨鱼夹使用教程
46,8082306,杨倩无缘巴黎奥运
47,8025613,19岁救人英雄好友发文悼念
48,8022278,四川小吃申请出战
49,7957543,硬核AI给你来点视觉震撼
50,7869048,功夫熊猫4里的双倍父爱
