index,hot,title,href
1,11106006,英格兰1:0塞尔维亚
2,10772307,太原理工晋级CUBAL全国四强
3,10578408,月背“土特产”即将快递到家
4,10140926,河南终于下雨了
5,9597759,埃里克森破门
6,9592389,老头杯宝蓝队夺冠
7,8561428,丹麦战平斯洛文尼亚
8,8543826,长大怎么可能不孤单
9,8505336,浙江杨梅出口迪拜超30元一颗
10,8455372,球在一起 他俩也在一起
11,8433294,姜萍老师：弟子不必不如师
12,8394679,你永远可以相信6月的新疆
13,8385917,“重庆中考成绩已出”系谣言
14,8351205,老师希望姜萍少被贴天才少女标签
15,8312999,荷兰2:1战胜波兰
16,8266836,黄亦玫结婚是因为爱
17,8216298,墨雨云间桐儿下线
18,8209642,韩媒：拒绝晋升成韩国新趋势
19,8207614,亚马尔小孩哥太牛了
20,8107397,高三学长学姐我想你们了
21,7998538,黑神话悟空试玩体验
22,7985198,姜萍圆梦大学不止职教高考
23,7949219,GEN 2:0 T1
24,7919233,献给自己疯癫而又热忱的一年
25,7795246,总决赛G5票价创波士顿体育史纪录
26,7752316,出去一个留子回来一个厨子
27,7737730,杨政遭驱逐X战队绝杀虎鲸
28,7680328,花小龙勇闯电影圈
29,7670032,city不city啊
30,7636299,新加坡门将桑尼现身上海
31,7633245,广州拟规定中小学禁止学生带手机
32,7632951,孟繁西街霸现场求婚
33,7627614,教师因救人迟到该不该受处分
34,7622681,申花1-1蓉城 蒋圣龙开场乌龙
35,7614628,高校回应教师因救人迟到受处分
36,7614132,暑假小众宝藏旅游地
37,7613252,墨雨云间花匠哥
38,7597371,请理性对待姜萍不要过度造神
39,7587485,我不打扮你真以为我长这样
40,7584489,送给父亲特别的礼物
41,7582716,看玫瑰的故事狠狠共情
42,7580610,朴振英enhypen合作舞台好混乱
43,7579598,福宝敲门：快让我进去
44,7579529,千禧时代回忆录
45,7572622,眨眼间我的小可爱长大了
46,7572119,安徽车牌歌来了
47,7571856,亚马尔带家庭作业踢欧洲杯
48,7563104,若月亮没来清唱
49,7559293,我全部的好脾气因为我爱你
50,7559136,可爱只是见森贝儿家族的门槛
