index,hot,title,href
1,12114938,外交部回应德国将移除5G中国部件
2,12081086,一年一度吃菌子大会
3,11731947,我国成功搭建6G试验网
4,11666248,跟着熊熊学拍照
5,10943497,从湖南跨省到贵州卖菜
6,10883356,记录我的第一次正式表白
7,9681391,是时候展示台球技术了
8,9504261,西安就没有淡季吗
9,9398110,范志毅说这就是欧洲杯的魅力
10,9393778,孙颖莎封训时哭了
11,9122859,萝卜快跑无人车售价20.46万
12,9073993,中国科学家发现新物种拟幽灵蛸
13,9058347,谢欣桐小黄分手
14,8992297,重庆批发市场被淹系谣言
15,8959617,欧洲杯和美洲杯决赛在同一天
16,8864269,中方回应日护卫舰进入中国领海
17,8861517,日本真的有“失去的三十年”吗
18,8790836,范戴克质疑裁判
19,8788982,周楷恒凯瑞图再演杭州德比
20,8734097,孟博龙超远四分晚安送别X战队
21,8686811,女子180万卖掉房子120万买回
22,8681359,老爸评测无骨鸡爪
23,8613444,旅行博主夫妇在日本攀岩途中身亡
24,8605122,当重庆人说起四川话
25,8600207,德里克怀特加入美国男篮
26,8493729,官方回应女厅官被举报论文抄袭
27,8381235,重庆野球场的强度
28,8250972,土耳其的酒店难道都这样吗
29,8202273,萝卜快跑辟谣有司机远程操控驾驶
30,7862023,85后法官被查引关注
31,7801256,香港警队年内换用国产手枪
32,7798940,萝卜快跑爆单网约车何去何从
33,7785878,老鼠怕猫这是谣传
34,7773609,外交部驳斥北约宣言涉华内容
35,7770467,小猫偷盐线索留了一地
36,7758506,Uzi说自己要凉了
37,7722096,童话镇慢动作
38,7721028,淘宝直播“抢”人后遗症
39,7718822,瓷器厂X战队出战街霸争霸赛
40,7718186,蜜雪冰城就拒卖冰杯事件致歉
41,7717259,暑假工已入侵直播间
42,7710451,交班挑战
43,7708425,驾校教练：教不了根本教不了
44,7703504,打卡恋与深空地铁站
45,7698817,长相思2口碑
46,7698506,女子结账4次故意漏扫码被拘
47,7693540,戴玫瑰花环反霸凌挑战
48,7688144,雨下一整晚演奏挑战
49,7682978,北约“直接警告”中国 中方驳斥
50,7682776,“果菌王”被中科院专家收了
