index,hot,title,href
1,11193803,2024NBA全明星正赛
2,10767101,今年不用再拔充电器了
3,9815416,冰雪运动跨越式发展激发新活力
4,9606378,网友称老凤祥清洗手镯logo被蹭掉
5,9583285,王师傅偶遇字母哥
6,9494037,普京：乌战事关乎俄存亡
7,9378039,第二十条高叶共情戏
8,9290617,从此墙的轮廓各种各样
9,9176363,多地警方辟谣捡钱包信息
10,9172386,过年后的离家落差感
11,9051724,郝秀萍三次手语问话
12,8999688,小女孩歌声神似周深
13,8625439,丽江通报游客未买手镯被赶下车
14,8621951,托普里亚KO大帝
15,8559442,伍虎万洁新婚快乐
16,8547569,北京一老破小房屋2%份额被拍卖
17,8534910,男孩被烟花炸伤身亡 家属发声
18,8529083,流浪棋王
19,8444120,下雨天你在等什么
20,8372485,两学校否认丢作业秦朗系本校学生
21,8279735,朔尔茨反对冯德莱恩任北约秘书长
22,8249474,相册里记录的生活边角料
23,8143979,当我马上开学
24,7818547,高合汽车宣布停工停产6个月
25,7652145,湖南将迎大到暴雪加持续性冻雨
26,7548570,约基奇东契奇互动
27,7493042,仙逆年番高燃来袭
28,7382057,朝花夕拾原来是这种感觉
29,7359468,南来北往姚玉玲贾金龙一见钟情
30,7358671,开工首日iPhone 15降至4588元
31,7276724,董瀚麟炮轰广东宏远
32,7245912,江苏工厂爆炸致3死2失联
33,7231053,世界破破烂烂玲玲缝缝补补
34,7143017,王毅驳斥中国在南海咄咄逼人谬论
35,7083638,为什么感觉他对洛杉矶很熟
36,7058260,我的爱就是要撞南墙
37,7044591,今日12时13分将迎来雨水节气
38,6937794,女游神也太惊艳了
39,6912817,HMA颁奖礼
40,6909340,被曝强吻女学生班主任已停职
41,6833430,现在流行电子抓周
42,6832798,吃表情包大作战
43,6801088,江湖之间翻唱大赛
44,6710115,赵雅芝戏剧幻城召唤金龙
45,6703450,虞书欣父母退出涉诈骗公司
46,6522141,南方的年才刚刚开始
47,6362498,尹烨解读Sora文生视频
48,6360267,刘建超：中国不走殖民掠夺的老路
49,6306404,林孝埈刘少昂摔出赛道
50,6254041,特雷杨观众席投中超远三分
