index,hot,title,href
1,12215288,中国香港8:7日本
2,12134993,吉罗纳0:3皇马
3,12059442,中国风电叶片产能占全球超六成
4,12044224,俄外长称将向叙提供军事援助
5,11408811,皇家贝蒂斯2:2巴萨
6,10943210,淄博舰原地掉头引现场惊呼
7,9611176,曼联2:3诺丁汉森林
8,9584362,曝伊朗军官从叙利亚撤离
9,9540845,NBA传奇名人赛
10,9377872,孙颖莎谈混双比赛
11,9371964,韩国前国防部长官被逮捕
12,9351643,韩国国会未通过尹锡悦弹劾案
13,9308659,斗破苍穹萧炎药老合体泪目了
14,9243720,一周谣言盘点
15,9234843,2024爱奇艺尖叫之夜
16,9216180,虞书欣回应双轨争议
17,9187752,谷爱凌夺冠
18,9181892,谷爱凌回应决赛摔倒
19,9168713,迪丽热巴回眸
20,9113652,抗癌网红卜娜娜去世
21,9078127,半个娱乐圈都来澳门了
22,8907225,黄子韬模仿大赛
23,8773973,Donk残局1v5五杀
24,8742013,记者实拍撤离大马士革
25,8635810,地铁逃生冰河夺金模式攻略
26,8623883,特朗普马克龙和泽连斯基三方会晤
27,8606240,杜锋透露广东队伤情
28,8603289,CBA两名球员被停赛
29,8599217,刘诗诗年度尖叫女演员
30,8590737,诺奖得主来抖音给我上课了
31,8528889,央行时隔半年首次增持黄金
32,8476659,迈克尔杰克逊女儿宣布订婚
33,8442543,于和伟付航一起passion
34,8431769,尖叫之夜红毯
35,8311804,王楚钦说想着发死他
36,8221461,山东在建冷链仓库起火9人失联
37,8210422,大梦归离全员颜值赢麻了
38,8209810,我是刑警心测破案大开眼界
39,8046736,九重紫导演太会拍了
40,7897720,永劫手游新英雄顾清寒
41,7888357,C罗本泽马老友再相逢
42,7850400,叙反政府武装进逼首都最后防线
43,7817082,张凌赫小水同框
44,7773992,美联储12月降息可能性85%
45,7762731,多国介入叙利亚乱局的底层逻辑
46,7751154,自己吓自己各行各业版
47,7743788,用树枝和瓶盖画出冬日的温暖
48,7742824,麦迪与姚明重逢
49,7736211,布朗死亡缠绕利拉德
50,7735111,向佐限定版hellokitty
