index,hot,title,href
1,12136625,BLG3:1战胜HLE挺进四强
2,12109552,哈马斯证实辛瓦尔已死
3,11830576,三季度1.6亿人次出入境
4,11624088,董宇辉独立80多天带货超10亿元
5,10931916,C罗绝杀
6,10792207,低利率时代普通人如何理财
7,9426356,利好政策频出如何影响A股
8,9422828,银行降息对普通人有何影响
9,9330252,韩方称朝鲜决定派兵援俄
10,9316027,胡明轩单人砍下40分
11,9244966,台高中签“青年服勤同意书”引恐慌
12,9204993,泰山4:1津门虎
13,9198387,菲律宾警方回应华人男子遭枪击
14,9009328,近日河南云南发生地震系谣言
15,8999542,张纪中官宣杜星霖四胎产女
16,8992779,宝马i3降价至18万
17,8968763,楼市调整加剧 拐点在哪
18,8836674,和平精英地铁逃生4v4更新
19,8581318,荆州市政府官网删除市长信息
20,8487463,上海海港1:3不敌成都蓉城
21,8412421,朝鲜男足转机时接热水吃泡面
22,8359489,张雨霏游泳世界杯银牌
23,8254300,泰山主帅崔康熙禁赛6场
24,8215673,吴谨言回应甩鞭子上热搜
25,8210405,覃海洋100米蛙泳夺冠
26,8209631,光遇爱让人走出孤岛
27,8131151,上海申花2:1逆转河南
28,8048004,煤气爆炸被烧伤女子家属发声
29,8021140,付航：差生也是有优点的
30,7994073,吴清回应“减持潮”
31,7846856,魏建军再提常压油箱
32,7832245,GAI回应被脱口秀演员调侃
33,7828647,布朗尼一级恶意犯规
34,7803355,周杰伦社交平台挂出骗子
35,7797145,春花焰版苹果香
36,7755131,被654俱乐部魔术表演硬控了
37,7743688,杨幂也是水灵灵玩上三折叠的梗了
38,7730008,王艺迪陈幸同上演球拍“失踪术”
39,7725208,360度运镜让我学会了
40,7710507,走在冷风中舞蹈挑战
41,7709181,Fantasticbaby闺蜜之歌
42,7705149,我的双十一必买清单
43,7684676,哈马斯领导人被杀有何影响
44,7683614,小小玩偶能有什么烦恼呢
45,7670657,随后便是我爱的秋天
46,7664314,谁懂疑心病歌词的含金量
47,7655196,揭秘与辉同行陕西行幕后
48,7648742,巴以冲突已致加沙42438人死亡
49,7639199,火箭大胜马刺
50,7638482,宝宝眼中的爸爸妈妈
