index,hot,title,href
1,10521048,荷兰战平法国
2,10375385,普京：韩若对乌供武将犯下大错
3,10372105,何以中国运载千秋
4,10330049,张欣怡毕业了
5,9757190,那英第七
6,9711738,波兰1:3奥地利
7,8489654,美国封禁俄杀毒软件卡巴斯基
8,8488808,理发店放的音乐太难听怎么办
9,8380527,高校毕业典礼花式大赏
10,8344303,夏日最爱的这口清凉
11,8331202,黄霄雲冲榜失败
12,8315440,Manner发声明致歉
13,8233601,阮经天发文告别母亲
14,8207514,歌手第七期竞演
15,8195050,店员与顾客冲突事件谁之过
16,8134849,黄霄雲狂飙海豚音
17,8130946,墨雨云间长公主人物立体了
18,8073640,西安银行副行长狄浩坠楼身亡
19,8054766,六公主发了7条吴谨言
20,7951957,陈泽打入电影圈了
21,7821391,汪苏泷张远的互动好可爱
22,7765883,罗晋新剧被啃老女暴力掀桌
23,7715435,毛晓彤水母撑伞造型
24,7691067,Manner怎么了
25,7684078,我偏要去北京
26,7677614,中考的时候你在想什么
27,7676434,寻找佛山功夫侠
28,7674265,“流放岭南”转场
29,7667838,跟着pay姐学手势舞
30,7657591,张韶涵长春演唱会
31,7650915,律师谈Manner员工顾客冲突
32,7641137,当北方人见到南方蜘蛛
33,7640675,当东北小伙没看到日出
34,7632977,怎么看咖啡店员工顾客冲突
35,7631192,小朋友果然是单核处理器
36,7630325,红尘客栈舞蹈挑战
37,7625234,重庆部分区域积水严重
38,7620617,怎么能错过运动的夏天
39,7620205,颜心记空降开播
40,7618963,A Legend宿命感太强了
41,7605667,听说贵州话很禁欲
42,7605379,起猛了 看见刘庸更新了
43,7598359,熬夜时最怕听到的声音
44,7598275,毕业后我一定红透半边天的
45,7595781,阿哲抖音首秀排面拉满
46,7593611,薛之谦徐州演唱会
47,7588346,前奏一响青春回来了
48,7587517,夏日清凉穿搭主打极简
49,7587344,当我用方协文的语气说话
50,7585762,艾尔登法环黄金树幽影
