index,hot,title,href
1,11543245,全面禁燃烟花爆竹不合法
2,11258617,中国小姐申请出战
3,10980936,中国首艘大洋钻探船试航
4,10967168,彭于晏现在着急了
5,10902478,无穷小亮鉴定网络热传生物
6,10853990,解锁天天跺脚生闷气
7,10497248,周海媚全部财产由母亲继承
8,10418805,媒体：借口安全禁放烟花是一刀切
9,10224279,捐赠震区羽绒服被倒卖为谣言
10,10067089,论狗子的模仿能力有多强
11,9927129,猫咪以为自己叫天猫精灵
12,9775654,杨威：承认孩子普通不丢脸
13,9303403,母女酒吧点一杯酒被嫌弃太少
14,9183463,当主人睡到中午忘记遛狗
15,9093511,韩国男演员李善均去世
16,9023401,河南14岁初中生校内坠亡
17,8969476,泰国前总理英拉被判无罪
18,8964689,结婚16年3孩非亲生当事人回应
19,8961887,学会这招让好兄弟汗流浃背
20,8954932,周海媚死因公布
21,8949032,3娃非亲生案女方母亲发声
22,8913605,吴宣仪爆改瑶妹
23,8855501,王祖蓝打卡港式老西餐牛排
24,8845224,关晓彤cos孙尚香
25,8795366,林俊杰回应粉丝用筋膜枪抢票
26,8768559,2024年新任务攒钱去西藏旅行
27,8741274,淘宝将支持仅退款
28,8715111,春节期间该不该禁放烟花爆竹
29,8702875,荣耀Magic 6搭载卫星通信
30,8619808,iQOO Neo9新机发布
31,8619605,跟着董宇辉在抖音学习
32,8592222,董宇辉新账号粉丝数破百万
33,8545393,大学老师课堂演示催眠术
34,8545143,AG晋级KIC世冠总决赛
35,8463452,小孩哥也太会了
36,8455025,一首歌告别2023
37,8271500,毛毛姐陪阿姨回老家了
38,8232956,刘美含短剧跨年夜陌生女人登门
39,8172472,刘德华邀梁朝伟听演唱会
40,8170482,程雨杉拥抱妈妈解开心结
41,8162884,媒体评董宇辉新号涨粉百万
42,8157458,闺蜜又准备报复她前任了
43,8107339,电影三大队成年人的酒桌好唏嘘
44,8066486,年会被安排表演节目belike
45,8031375,当你第一次去东北朋友家玩
46,7991261,短圆眼爆改上扬眼
47,7921756,电影金手指北京首映礼
48,7830081,大合唱版西楼儿女
49,7820872,东方甄选拟15亿出售教育业务
50,7817035,武家男团的塑料父子情
