index,hot,title,href
1,12122675,范志毅看国足比赛吸上氧了
2,12082805,林良铭推射破门
3,11829436,中国姑娘巴西街头发起舞蹈挑战
4,11807869,中国在沙特发行主权债券的背后
5,11183844,最适合冬天的钓鱼经验来了
6,10911115,栓Q哥唱Baby了
7,9080378,过年氛围提前搞起来了
8,9067557,取消普宅非普宅标准对房价的影响
9,9044923,中国互联网30年网事悠悠
10,9006154,虞书欣丁禹兮纯恨夫妻
11,8910612,世预赛国足1:3日本
12,8819414,闫妮没认出来健身成功的沙溢
13,8691621,SpaceX星舰第六次试飞
14,8632599,伊犁公安公布打谣典型案例
15,8500657,国足小组垫底
16,8490336,蛇墩墩亮相
17,8444817,麦多多平台负责人已被抓
18,8095496,近距离看火山是什么体验
19,7825219,森保一说国足很有潜力
20,7823220,国足五年来首次对日本破门
21,7792002,姿态队被判负
22,7789258,伊万：国足队员配得上掌声
23,7765573,国足有进步了
24,7761436,黄健翔评价国足防守
25,7760505,华为Mate70全新配色
26,7742956,阿娇永夜星河一键切换怨女
27,7741887,看看你的羽绒服穿搭公式
28,7733247,想打个电话给你
29,7726426,人累了可以靠在咪的胸膛
30,7725945,别怕我伤心听心碎了
31,7718063,这个烤串舞看着就香
32,7698174,周传雄很高兴音乐会青花现场
33,7698159,所以人生的意义是什么
34,7696202,这个BGM又杀回来了
35,7691360,赵薇公司被强制执行1.4万
36,7688429,徐振轩的新人美时期
37,7687741,狗狗：是你高估我了
38,7678826,路灯下的双人舞
39,7678698,异地恋分开的那一刻好戳人
40,7676436,龟龟你先吃吧
41,7672082,永夜星河开车梗图照进现实
42,7665243,初雪请你快快来
43,7652467,唯一纯白的茉莉花
44,7652112,麦琳 美环花子
45,7651949,此刻世界不在书里而在我脚下
46,7649570,手作一朵雪花迎接冬天
47,7647823,赵露思拍的刘宇宁落日回眸
48,7645959,狗子主打一个配合
49,7642051,国际空间站接近寿命末期
50,7635567,超适配冬天的清冷感妆容
