index,hot,title,href
1,11087133,极端高温对经济有何影响
2,10807096,亨特定罪对拜登意味着什么
3,10644977,中国航空再添“新成员”
4,10310674,我和我闺蜜老年旅行既视感
5,9788418,期末考试前的大学生们
6,9725826,已老实求放过是什么梗
7,8595743,中式变装又卷出了新花样
8,8582157,杰里韦斯特去世
9,8495264,古天乐被曝欠债830万港币
10,8479199,新加坡门将为什么火了
11,8458513,总有一束光为你而来
12,8391445,扫码可领个人劳动补贴系谣言
13,8286831,睡不醒的高考生
14,8267086,家门口遭捅死女孩曾被保送北外
15,8257398,江疏影说自己有baby肚
16,8219337,郑恺的哄睡导师是张颜齐
17,8211602,福宝与大家见面啦
18,8158629,国台办回应男子驾小艇进台湾
19,8155149,柳岩浪姐人间清醒
20,8143000,院方通报患者持刀刺伤护士
21,8117774,季淑然和长公主密谋除掉薛芳菲
22,8031339,俞敏洪董宇辉共赴山西之约
23,7922697,佟大为万茜在演一种很新的暧昧
24,7916454,王者荣耀真人版
25,7882146,栀子花价格飙涨至35元每斤
26,7797826,墨雨云间请苍天鉴忠奸
27,7788118,宿舍没空调大学生排队领冰块
28,7746797,官方通报蜜雪冰城员工水池洗脚
29,7723449,蛋仔萌宠转场
30,7659629,高圆圆宋慧乔车银优同框
31,7646944,游客疑因拍城管被抢夺手机
32,7642071,live图记录日常翻车碎片
33,7641987,3艘055大驱赴南海协同演练
34,7635348,这一刻终于圆了少时的武侠梦
35,7628216,超百枚火箭弹射向以色列北部
36,7625463,Faker抖音LOL带货首秀
37,7618856,国足归化奥斯卡或将提上日程
38,7616491,中国足球拥有全世界最好的球迷
39,7610502,一个高三生的书库
40,7609532,老公走路像醉酒妻子报警求抓
41,7607334,晋级18强赛后离世界杯有多远
42,7593562,网友打卡新加坡门将椰浆饭店
43,7591912,我有21个问题想问你
44,7591588,吃不完的东北豆角子
45,7585193,雷军的早餐吃什么
46,7585091,第十幕遇上各地文旅
47,7582486,范志毅说晋级高兴也要想想差距
48,7582205,墨雨云间镜头语言
49,7576213,甘肃国资委被诉支付1.2亿水费
50,7566650,塔瑞斯世界开服
