index,hot,title,href
1,11603657,美媒报道“中国游客消失”
2,11344658,苹果上架近500元龙年手机壳
3,10286663,一个意外发现改变太空授课
4,10119740,青岛对阵吉林全场高喊黑哨
5,10084074,全网都中了这首毒蘑菇的毒
6,9912899,乌军总司令扎卢日内被解职
7,9685600,哈登倒地拼抢助攻威少
8,9653397,长沙初雪
9,9595960,济南粮库发生爆炸系谣言
10,9580256,杨紫范丞丞要久久爱角色号
11,9553130,扬科维奇说国足这次不“算分”
12,9376345,东方甄选谈董宇辉收益
13,9307728,解清帅被换上了“回家”的牌子
14,9304470,老师上课教育学生获百万点赞
15,9291447,惊艳雪场的美少女孙子都3岁了
16,9237713,高泽宇丸子来给宁夏上分了
17,9225800,用仙女棒拍出奇异博士传送门
18,9126862,张家界2024首场大雪
19,9125175,桂林通报米粉店阴阳菜单
20,9111570,餐桌上的24K年味
21,9062285,吴京不接电话被谢楠质问
22,9034769,洛阳多景区将对属龙名龙游客免票
23,9029586,en版PS我爱你奔赴感拉满
24,9022085,成都下雪了
25,9010119,走进牛津年级第一的大女主剧本
26,8966507,C罗抵达深圳
27,8953591,幻兽帕鲁Steam同时在线破百万
28,8950874,张冠李戴的改编
29,8929941,摇太阳李庚希被彭昱畅气到翻白眼
30,8922820,有一种暗恋叫蒋翼黄瀛子
31,8920161,徐明浩晒粉丝硬核应援
32,8848030,杨瀚森受伤
33,8797044,阿富汗失事飞机信息
34,8785749,东北雨姐带小砂糖橘畅玩本溪
35,8743639,贵州省委常委陈少波跨省履新
36,8732802,没人能空手走出景德镇
37,8695516,南方小橘子的北京旅游Vlog
38,8589319,网友在九寨沟遇到水獭
39,8509813,张佳宁新剧饰演唢呐高手
40,8504515,皇马3:2阿尔梅里亚
41,8469852,张大仙王者星耀局真神导师
42,8421498,要久久爱 蓝亦菲去世了吗
43,8269393,印度将在印缅边境建围栏
44,8221697,张踩铃李蠕蠕新剧首发预告
45,8220875,张大仙王者归来
46,8177146,袁咏仪回应港娱三大恶人称号
47,8175436,C罗接受抖音博主专访
48,8100345,CBA裁判
49,8011852,小曲儿舞蹈挑战
50,7964471,渤海西部部分海域军事训练
