index,hot,title,href
1,11616277,十四届全国人大实有代表2956人
2,11284331,这才是适合大学生的穷游
3,11007645,嫦娥六号今年将前往月背采样
4,10253978,春天就要薄荷曼波
5,9898983,当宝宝开始学习自己睡觉
6,9719309,贵州省长：全面清理拖欠企业账款
7,9533108,不同学科老师开学第一天
8,9518980,永劫无间手游过审
9,9474956,河南辟谣多地发生山火
10,9420822,抖音科普视频进乡村课堂了
11,9391406,92岁大爷提起宗庆后泪崩
12,9385851,男生的选择性拍照技术
13,9352339,官方通报社火队遭车冲撞
14,9344746,少年假扮武警到县武装部办调动
15,9310803,丢刀侍卫站C位了
16,9222599,许家印前妻向次子追讨逾10亿港元
17,9190580,太阳升起时我们要更幸福
18,9173774,当你有了女友翻译器
19,9164408,曼城6:2大胜卢顿
20,9154294,中方回应英伟达把华为当竞争对手
21,9145448,男子与智残女子结婚卷走450万
22,9140889,李亚鹏直播哭穷
23,9126470,包小柏用AI“复活”女儿
24,9110389,我不在家妈妈偷数我的红包
25,9088724,周也 拽脸美女妆
26,9077928,紫川空降
27,9077260,教育局回应教室当宿舍住几十人
28,9065720,宝宝饿了疯狂暗示妈妈
29,9051082,男子未拔充电器将枕头烧出洞
30,9044990,政协委员建议周六日高速路半价
31,9029823,百看不厌的电视剧有哪些
32,9020368,胡可聊孩子叛逆期
33,9018318,车企降价现在要不要买车
34,9006263,闺蜜花5000块学的吉他
35,8994892,梅西ins粉丝数破5亿
36,8981998,美国共产主义者宣布成立政党
37,8967915,俄官员回应马克龙言论
38,8957962,猎冰有自己的莽村
39,8951185,张娜拉43岁近照
40,8940668,各地人无法拒绝的事
41,8933817,胡雷因奶奶去世情绪崩溃
42,8912470,怦怦心跳手势舞
43,8906592,你怎么看董宇辉清空微博
44,8838999,清明上河园“小乞丐”接绣球
45,8829640,郑合惠子坦诚自己戴了假发
46,8822251,网友都在惦记丐哥的饭碗
47,8795341,董宇辉回应清空微博
48,8784368,黑神话悟空过审
49,8723690,FF全球CEO称仍需额外资金
50,8688706,美发言人遭遇记者神回复
