index,hot,title,href
1,11108969,巴萨总比分4:6负于巴黎
2,11030854,中国国奥0:1不敌10人日本
3,10849497,考古发掘迄今楚国最高等级墓葬
4,10793072,多特蒙德晋级欧冠4强
5,10206831,普京获颁总统证
6,9903659,iPhone16Pro起步存储或为256GB
7,8748429,吉林松原3.9级地震
8,8746440,中央两天打两虎
9,8713967,500万粉丝主播撞脸命案逃犯
10,8674794,媒体：女仆跪式服务该消停了
11,8547020,看1万张图不如看1朵真牡丹花
12,8472064,“天津急救中心招聘司机”不实
13,8458243,当你找化妆师剪头
14,8450590,打工人的风感波粒穿搭
15,8415454,满级反PUA女友
16,8402620,城中之城是个巨大的修罗场
17,8333385,赵薇名下股权再遭冻结
18,8321410,四川队贵州队在云南开泼了
19,8252174,春日松弛感穿搭
20,8175503,4名不满14周岁未成年人获刑
21,8013849,以色列：警惕伊朗动用核武
22,7897203,河南三蹦子已畅销20多国
23,7837515,格里芬退役
24,7823500,以色列战时内阁讨论报复伊朗方案
25,7818832,新国九条保姆级解读来了
26,7790060,承欢记一夜承明有迹可循
27,7756257,欢乐钓鱼大师最强鱼货
28,7743495,俄罗斯挫败一起恐怖袭击企图
29,7719860,比樱花雨更浪漫的是樱花雪
30,7683393,骑车和不骑车的都沉默了
31,7669465,为什么名校青睐数学好的学生
32,7668725,徐正溪退圈声明后现身片场
33,7649720,山西失踪两姐妹已找到
34,7631183,儿子为父亲盖衣服发现其已离世
35,7630121,模仿大力仑喊出梦想
36,7616864,泼水节整活赛道强得可怕
37,7611104,偏偏你最争气
38,7597086,这是现实版盘丝洞吗
39,7594667,你买下铺会让别人坐吗
40,7588973,雷军直播预告
41,7587222,我的计划就是一直自由
42,7578987,晒出我的星座宝宝
43,7578963,洗干净的狗狗能有多惊艳
44,7571059,当我模仿老婆睡前行为
45,7568182,我为自己的星座歌唱
46,7565361,鼎：幸福就在你的身后
47,7559173,当宿舍姐妹一起唱歌
48,7559146,我以为三十岁的我
49,7554885,春日花花妆造
50,7551952,谁的青春不迷茫转场
