index,hot,title,href
1,11540458,正月初五接财神
2,11516890,过年像是做了一场热闹的梦
3,11416809,龙年春节庆祝活动在多国举行
4,11385441,风里已经有情人节氛围感了
5,9913894,大年初五迎自驾出行高峰期
6,9434784,小孩哥：把钱给我我养你
7,9380703,爱很简单一餐一饭
8,9332089,迎财神的正确打开方式
9,9298752,网传教改实验区缩短学制为假
10,9257915,打卡财政部
11,9255534,人民网评热辣滚烫
12,9234479,被摇太阳彭昱畅初吻治愈了
13,9187121,坐上火车去拉萨
14,9123868,这饺子是硬币馅的吧
15,9119751,向太曝向华强演龙五内幕
16,9119616,学者研究断亲现象
17,9066016,祝大家都像乐莹一样热辣滚烫
18,9047984,幼师面试就是i人噩梦
19,8944383,山东泰山2:3川崎前锋
20,8889992,热辣滚烫雷佳音贾玲吵架吵笑了
21,8659063,乔杉演我看见贾玲的反应
22,8578468,苏州偶遇赵丽颖
23,8483621,从鲜花开始收集浪漫
24,8463572,有狗狗陪伴的假期好幸福
25,8459851,乔丹儿子与皮蓬前妻分手
26,8452455,演员王东承认家暴
27,8403798,黄英在大凉山体验路边生日会
28,8400048,女子铁锹劝架袋鼠被停职2天
29,8304943,范丞丞8G网速回应网友评论
30,8295981,网友开始翻拍文旅之王
31,8169355,春晚幕后纪录片公布
32,8128479,00后女兵掌舵万吨大驱
33,8036552,一觉醒来穿到大唐狄公案了
34,7786819,恋爱脑研究报告
35,7748959,正月里的舅舅有多难
36,7618247,林亦扬的礼物是银行卡
37,7611957,贾玲和观众用真诚双向奔赴
38,7603992,新年解腻开胃菜
39,7374376,NPC的职业素养
40,7337031,南来北往素芳去世哭惨了
41,7331054,赵丽颖手部戏细节
42,7275988,电影八戒呼吁增加排片
43,7226804,各地人送礼特色
44,7213002,抖音嘿人李逵回应马丽
45,7206924,照片涂鸦太适合记录生活了
46,7164295,伊朗称成功从军舰发射远程弹道导弹
47,7155052,小伙2000元办农村春晚
48,7119110,柬埔寨公主用中文拜年
49,7114670,假如拜年像爱豆签售
50,6974358,看完熊出没和精神内耗说不
