index,hot,title,href
1,11120810,名嘴批赖清德把台民众放赌桌上
2,11090560,台飞行员称台空军迟早垮掉
3,10884186,三夏时节感受丰收之美
4,10629813,以色列特拉维夫遭袭
5,10028016,独行侠vs森林狼G3
6,9921960,东部战区越海突击画面发布
7,8787650,杨幂主动给章子怡让镜头
8,8727714,警方回应博主打假黄金回收店
9,8723488,如何看待聘任制公务员的高薪
10,8683860,不是P图是艺术
11,8667479,赵丽颖把抖音拍成朋友圈
12,8664122,越海杀器量大管饱
13,8576421,警方辟谣女子拐卖儿童被抓
14,8546419,SuperJunior13人合体
15,8487033,王妈公司回应员工待遇争议
16,8473187,音乐一响贝微微出场
17,8432015,庆余年2林相请求告老还乡
18,8417788,赵露思冰蓝长裙
19,8400930,黄山景区内发生雷击致13伤
20,8384315,亲眼见到歼20了
21,8362467,黄宣 我结婚了啦那又怎样
22,8350023,广东进入龙舟时间
23,8344288,寻亲33年的张怀远成功认亲
24,8335553,林俊杰胡彦斌神仙合唱
25,8335229,丁霞被官宣离队
26,8328642,特种兵再度回归武功山
27,8309608,沈月王鹤棣时隔六年再次合体
28,8268688,若月亮还没来rap翻唱挑战
29,8253335,警方通报几十亩小麦被盗割
30,8227473,给高考生的一点建议
31,8219375,美国男子被警方逼供承认杀父
32,8206398,央美作品超级蜂巢引热议
33,8183419,迪丽热巴AI造型仿妆
34,8165831,凤凰传奇版海底雨中封神
35,8158774,芒果台音响效果
36,8144755,境外间谍恐吓国内专家强迫合作
37,8141536,英战机坠毁 威廉凯特联合发声
38,8133080,吧啦姐火力全开
39,8118424,无人机模仿东契奇绝杀
40,8026237,北京国安5:2南通支云
41,8010999,苏有朋把王羲之演活了
42,7965139,王丰谈台湾的命运
43,7926851,雷军评论区让人破防
44,7893802,会乐器就是随时能助兴
45,7853940,分享家乡的美景给你
46,7809538,台风艾云尼
47,7773566,网友给马吉德爷爷创作的画
48,7724432,我比从前更好了
49,7649688,我跟你讲 我今天很想你
50,7642883,一人说一个高考知识点
